Id, title, description, last_update, length, rating, release_year, rental_rate, replacement_cost, special_features
3,ADAPTATION HOLES,A Astounding Reflection of a Lumberjack And a Car who must Sink a Lumberjack in A Baloon Factory,2006-02-15,50,NC-17,2006,2.99,18.99,Trailers,Deleted Scenes
7,AIRPLANE SIERRA,A Touching Saga of a Hunter And a Butler who must Discover a Butler in A Jet Boat,2006-02-15,62,PG-13,2006,4.99,28.99,Trailers,Deleted Scenes
12,ALASKA PHANTOM,A Fanciful Saga of a Hunter And a Pastry Chef who must Vanquish a Boy in Australia,2006-02-15,136,PG,2006,0.99,22.99,Commentaries,Deleted Scenes
16,ALLEY EVOLUTION,A Fast-Paced Drama of a Robot And a Composer who must Battle a Astronaut in New Orleans,2006-02-15,180,NC-17,2006,2.99,23.99,Trailers,Commentaries
19,AMADEUS HOLY,A Emotional Display of a Pioneer And a Technical Writer who must Battle a Man in A Baloon,2006-02-15,113,PG,2006,0.99,20.99,Commentaries,Deleted Scenes,Behind the Scenes
23,ANACONDA CONFESSIONS,A Lacklusture Display of a Dentist And a Dentist who must Fight a Girl in Australia,2006-02-15,92,R,2006,0.99,9.99,Trailers,Deleted Scenes
27,ANONYMOUS HUMAN,A Amazing Reflection of a Database Administrator And a Astronaut who must Outrace a Database Administrator in A Shark Tank,2006-02-15,179,NC-17,2006,0.99,12.99,Deleted Scenes,Behind the Scenes
31,APACHE DIVINE,A Awe-Inspiring Reflection of a Pastry Chef And a Teacher who must Overcome a Sumo Wrestler in A U-Boat,2006-02-15,92,NC-17,2006,4.99,16.99,Commentaries,Deleted Scenes,Behind the Scenes
34,ARABIA DOGMA,A Touching Epistle of a Madman And a Mad Cow who must Defeat a Student in Nigeria,2006-02-15,62,NC-17,2006,0.99,29.99,Commentaries,Deleted Scenes
39,ARMAGEDDON LOST,A Fast-Paced Tale of a Boat And a Teacher who must Succumb a Composer in An Abandoned Mine Shaft,2006-02-15,99,G,2006,0.99,10.99,Trailers
43,ATLANTIS CAUSE,A Thrilling Yarn of a Feminist And a Hunter who must Fight a Technical Writer in A Shark Tank,2006-02-15,170,G,2006,2.99,15.99,Behind the Scenes
47,BABY HALL,A Boring Character Study of a A Shark And a Girl who must Outrace a Feminist in An Abandoned Mine Shaft,2006-02-15,153,NC-17,2006,4.99,23.99,Commentaries
50,BAKED CLEOPATRA,A Stunning Drama of a Forensic Psychologist And a Husband who must Overcome a Waitress in A Monastery,2006-02-15,182,G,2006,2.99,20.99,Commentaries,Behind the Scenes
55,BARBARELLA STREETCAR,A Awe-Inspiring Story of a Feminist And a Cat who must Conquer a Dog in A Monastery,2006-02-15,65,G,2006,2.99,27.99,Behind the Scenes
61,BEAUTY GREASE,A Fast-Paced Display of a Composer And a Moose who must Sink a Robot in An Abandoned Mine Shaft,2006-02-15,175,G,2006,4.99,28.99,Trailers,Commentaries
65,BEHAVIOR RUNAWAY,A Unbelieveable Drama of a Student And a Husband who must Outrace a Sumo Wrestler in Berlin,2006-02-15,100,PG,2006,4.99,20.99,Trailers,Deleted Scenes,Behind the Scenes
69,BEVERLY OUTLAW,A Fanciful Documentary of a Womanizer And a Boat who must Defeat a Madman in The First Manned Space Station,2006-02-15,85,R,2006,2.99,21.99,Trailers
74,BIRCH ANTITRUST,A Fanciful Panorama of a Husband And a Pioneer who must Outgun a Dog in A Baloon,2006-02-15,162,PG,2006,4.99,18.99,Trailers,Commentaries,Deleted Scenes
78,BLACKOUT PRIVATE,A Intrepid Yarn of a Pastry Chef And a Mad Scientist who must Challenge a Secret Agent in Ancient Japan,2006-02-15,85,PG,2006,2.99,12.99,Trailers,Deleted Scenes
82,BLOOD ARGONAUTS,A Boring Drama of a Explorer And a Man who must Kill a Lumberjack in A Manhattan Penthouse,2006-02-15,71,G,2006,0.99,13.99,Trailers,Commentaries,Behind the Scenes
86,BOOGIE AMELIE,A Lacklusture Character Study of a Husband And a Sumo Wrestler who must Succumb a Technical Writer in The Gulf of Mexico,2006-02-15,121,R,2006,4.99,11.99,Commentaries,Behind the Scenes
89,BORROWERS BEDAZZLED,A Brilliant Epistle of a Teacher And a Sumo Wrestler who must Defeat a Man in An Abandoned Fun House,2006-02-15,63,G,2006,0.99,22.99,Commentaries,Deleted Scenes,Behind the Scenes
93,BRANNIGAN SUNRISE,A Amazing Epistle of a Moose And a Crocodile who must Outrace a Dog in Berlin,2006-02-15,121,PG,2006,4.99,27.99,Trailers
97,BRIDE INTRIGUE,A Epic Tale of a Robot And a Monkey who must Vanquish a Man in New Orleans,2006-02-15,56,G,2006,0.99,24.99,Trailers,Commentaries,Behind the Scenes
101,BROTHERHOOD BLANKET,A Fateful Character Study of a Butler And a Technical Writer who must Sink a Astronaut in Ancient Japan,2006-02-15,73,R,2006,0.99,26.99,Behind the Scenes
105,BULL SHAWSHANK,A Fanciful Drama of a Moose And a Squirrel who must Conquer a Pioneer in The Canadian Rockies,2006-02-15,125,NC-17,2006,0.99,21.99,Deleted Scenes
109,BUTTERFLY CHOCOLAT,A Fateful Story of a Girl And a Composer who must Conquer a Husband in A Shark Tank,2006-02-15,89,G,2006,0.99,17.99,Behind the Scenes
113,CALIFORNIA BIRDS,A Thrilling Yarn of a Database Administrator And a Robot who must Battle a Database Administrator in Ancient India,2006-02-15,75,NC-17,2006,4.99,19.99,Trailers,Commentaries,Deleted Scenes
117,CANDLES GRAPES,A Fanciful Character Study of a Monkey And a Explorer who must Build a Astronaut in An Abandoned Fun House,2006-02-15,135,NC-17,2006,4.99,15.99,Trailers,Deleted Scenes
123,CASABLANCA SUPER,A Amazing Panorama of a Crocodile And a Forensic Psychologist who must Pursue a Secret Agent in The First Manned Space Station,2006-02-15,85,G,2006,4.99,22.99,Trailers,Deleted Scenes,Behind the Scenes
127,CAT CONEHEADS,A Fast-Paced Panorama of a Girl And a A Shark who must Confront a Boy in Ancient India,2006-02-15,112,G,2006,4.99,14.99,Commentaries,Deleted Scenes
131,CENTER DINOSAUR,A Beautiful Character Study of a Sumo Wrestler And a Dentist who must Find a Dog in California,2006-02-15,152,PG,2006,4.99,12.99,Deleted Scenes
134,CHAMPION FLATLINERS,A Amazing Story of a Mad Cow And a Dog who must Kill a Husband in A Monastery,2006-02-15,51,PG,2006,4.99,21.99,Trailers
138,CHARIOTS CONSPIRACY,A Unbelieveable Epistle of a Robot And a Husband who must Chase a Robot in The First Manned Space Station,2006-02-15,71,R,2006,2.99,29.99,Deleted Scenes,Behind the Scenes
142,CHICKEN HELLFIGHTERS,A Emotional Drama of a Dog And a Explorer who must Outrace a Technical Writer in Australia,2006-02-15,122,PG,2006,0.99,24.99,Trailers,Commentaries,Deleted Scenes,Behind the Scenes
146,CHITTY LOCK,A Boring Epistle of a Boat And a Database Administrator who must Kill a Sumo Wrestler in The First Manned Space Station,2006-02-15,107,G,2006,2.99,24.99,Commentaries
150,CIDER DESIRE,A Stunning Character Study of a Composer And a Mad Cow who must Succumb a Cat in Soviet Georgia,2006-02-15,101,PG,2006,2.99,9.99,Behind the Scenes
154,CLASH FREDDY,A Amazing Yarn of a Composer And a Squirrel who must Escape a Astronaut in Australia,2006-02-15,81,G,2006,2.99,12.99,Commentaries,Deleted Scenes
157,CLOCKWORK PARADISE,A Insightful Documentary of a Technical Writer And a Feminist who must Challenge a Cat in A Baloon,2006-02-15,143,PG-13,2006,0.99,29.99,Trailers,Commentaries,Deleted Scenes,Behind the Scenes
161,CLUE GRAIL,A Taut Tale of a Butler And a Mad Scientist who must Build a Crocodile in Ancient China,2006-02-15,70,NC-17,2006,4.99,27.99,Trailers,Commentaries,Behind the Scenes
165,COLDBLOODED DARLING,A Brilliant Panorama of a Dentist And a Moose who must Find a Student in The Gulf of Mexico,2006-02-15,70,G,2006,4.99,27.99,Trailers,Deleted Scenes
169,COMFORTS RUSH,A Unbelieveable Panorama of a Pioneer And a Husband who must Meet a Mad Cow in An Abandoned Mine Shaft,2006-02-15,76,NC-17,2006,2.99,19.99,Commentaries,Behind the Scenes
172,CONEHEADS SMOOCHY,A Touching Story of a Womanizer And a Composer who must Pursue a Husband in Nigeria,2006-02-15,112,NC-17,2006,4.99,12.99,Deleted Scenes,Behind the Scenes
175,CONFUSED CANDLES,A Stunning Epistle of a Cat And a Forensic Psychologist who must Confront a Pioneer in A Baloon,2006-02-15,122,PG-13,2006,2.99,27.99,Trailers,Commentaries,Deleted Scenes,Behind the Scenes
179,CONQUERER NUTS,A Taut Drama of a Mad Scientist And a Man who must Escape a Pioneer in An Abandoned Mine Shaft,2006-02-15,173,G,2006,4.99,14.99,Commentaries,Deleted Scenes,Behind the Scenes
182,CONTROL ANTHEM,A Fateful Documentary of a Robot And a Student who must Battle a Cat in A Monastery,2006-02-15,185,G,2006,4.99,9.99,Commentaries
186,CRAFT OUTFIELD,A Lacklusture Display of a Explorer And a Hunter who must Succumb a Database Administrator in A Baloon Factory,2006-02-15,64,NC-17,2006,0.99,17.99,Deleted Scenes,Behind the Scenes
190,CREEPERS KANE,A Awe-Inspiring Reflection of a Squirrel And a Boat who must Outrace a Car in A Jet Boat,2006-02-15,172,NC-17,2006,4.99,23.99,Trailers,Behind the Scenes
194,CROW GREASE,A Awe-Inspiring Documentary of a Woman And a Husband who must Sink a Database Administrator in The First Manned Space Station,2006-02-15,104,PG,2006,0.99,22.99,Trailers,Commentaries,Behind the Scenes
198,CRYSTAL BREAKING,A Fast-Paced Character Study of a Feminist And a Explorer who must Face a Pastry Chef in Ancient Japan,2006-02-15,184,NC-17,2006,2.99,22.99,Trailers,Commentaries
201,CYCLONE FAMILY,A Lacklusture Drama of a Student And a Monkey who must Sink a Womanizer in A MySQL Convention,2006-02-15,176,PG,2006,2.99,18.99,Trailers,Deleted Scenes
207,DANGEROUS UPTOWN,A Unbelieveable Story of a Mad Scientist And a Woman who must Overcome a Dog in California,2006-02-15,121,PG,2006,4.99,26.99,Commentaries
211,DARLING BREAKING,A Brilliant Documentary of a Astronaut And a Squirrel who must Succumb a Student in The Gulf of Mexico,2006-02-15,165,PG-13,2006,4.99,20.99,Commentaries,Behind the Scenes
214,DAUGHTER MADIGAN,A Beautiful Tale of a Hunter And a Mad Scientist who must Confront a Squirrel in The First Manned Space Station,2006-02-15,59,PG-13,2006,4.99,13.99,Trailers
217,DAZED PUNK,A Action-Packed Story of a Pioneer And a Technical Writer who must Discover a Forensic Psychologist in An Abandoned Amusement Park,2006-02-15,120,G,2006,4.99,20.99,Commentaries,Deleted Scenes
224,DESPERATE TRAINSPOTTING,A Epic Yarn of a Forensic Psychologist And a Teacher who must Face a Lumberjack in California,2006-02-15,81,G,2006,4.99,29.99,Deleted Scenes
228,DETECTIVE VISION,A Fanciful Documentary of a Pioneer And a Woman who must Redeem a Hunter in Ancient Japan,2006-02-15,143,PG-13,2006,0.99,16.99,Trailers,Commentaries,Behind the Scenes
232,DIRTY ACE,A Action-Packed Character Study of a Forensic Psychologist And a Girl who must Build a Dentist in The Outback,2006-02-15,147,NC-17,2006,2.99,29.99,Commentaries,Deleted Scenes,Behind the Scenes
235,DIVIDE MONSTER,A Intrepid Saga of a Man And a Forensic Psychologist who must Reach a Squirrel in A Monastery,2006-02-15,68,PG-13,2006,2.99,13.99,Trailers,Commentaries
240,DOLLS RAGE,A Thrilling Display of a Pioneer And a Frisbee who must Escape a Teacher in The Outback,2006-02-15,120,PG-13,2006,2.99,10.99,Commentaries,Deleted Scenes
245,DOUBLE WRATH,A Thoughtful Yarn of a Womanizer And a Dog who must Challenge a Madman in The Gulf of Mexico,2006-02-15,177,R,2006,0.99,28.99,Trailers,Deleted Scenes,Behind the Scenes
249,DRACULA CRYSTAL,A Thrilling Reflection of a Feminist And a Cat who must Find a Frisbee in An Abandoned Fun House,2006-02-15,176,G,2006,0.99,26.99,Commentaries
253,DRIFTER COMMANDMENTS,A Epic Reflection of a Womanizer And a Squirrel who must Discover a Husband in A Jet Boat,2006-02-15,61,PG-13,2006,4.99,18.99,Trailers,Behind the Scenes
259,DUCK RACER,A Lacklusture Yarn of a Teacher And a Squirrel who must Overcome a Dog in A Shark Tank,2006-02-15,116,NC-17,2006,2.99,15.99,Behind the Scenes
261,DUFFEL APOCALYPSE,A Emotional Display of a Boat And a Explorer who must Challenge a Madman in A MySQL Convention,2006-02-15,171,G,2006,0.99,13.99,Commentaries
264,DWARFS ALTER,A Emotional Yarn of a Girl And a Dog who must Challenge a Composer in Ancient Japan,2006-02-15,101,G,2006,2.99,13.99,Commentaries,Deleted Scenes
267,EAGLES PANKY,A Thoughtful Story of a Car And a Boy who must Find a A Shark in The Sahara Desert,2006-02-15,140,NC-17,2006,4.99,14.99,Trailers,Commentaries,Behind the Scenes
270,EARTH VISION,A Stunning Drama of a Butler And a Madman who must Outrace a Womanizer in Ancient India,2006-02-15,85,NC-17,2006,0.99,29.99,Trailers,Commentaries,Deleted Scenes
273,EFFECT GLADIATOR,A Beautiful Display of a Pastry Chef And a Pastry Chef who must Outgun a Forensic Psychologist in A Manhattan Penthouse,2006-02-15,107,PG,2006,0.99,14.99,Commentaries
276,ELEMENT FREDDY,A Awe-Inspiring Reflection of a Waitress And a Squirrel who must Kill a Mad Cow in A Jet Boat,2006-02-15,115,NC-17,2006,4.99,28.99,Commentaries,Behind the Scenes
279,ELIZABETH SHANE,A Lacklusture Display of a Womanizer And a Dog who must Face a Sumo Wrestler in Ancient Japan,2006-02-15,152,NC-17,2006,4.99,11.99,Trailers,Deleted Scenes,Behind the Scenes
282,ENCOUNTERS CURTAIN,A Insightful Epistle of a Pastry Chef And a Womanizer who must Build a Boat in New Orleans,2006-02-15,92,NC-17,2006,0.99,20.99,Trailers
285,ENGLISH BULWORTH,A Intrepid Epistle of a Pastry Chef And a Pastry Chef who must Pursue a Crocodile in Ancient China,2006-02-15,51,PG-13,2006,0.99,18.99,Deleted Scenes
288,ESCAPE METROPOLIS,A Taut Yarn of a Astronaut And a Technical Writer who must Outgun a Boat in New Orleans,2006-02-15,167,R,2006,2.99,20.99,Trailers
291,EVOLUTION ALTER,A Fanciful Character Study of a Feminist And a Madman who must Find a Explorer in A Baloon Factory,2006-02-15,174,PG-13,2006,0.99,10.99,Behind the Scenes
295,EXPENDABLE STALLION,A Amazing Character Study of a Mad Cow And a Squirrel who must Discover a Hunter in A U-Boat,2006-02-15,97,PG,2006,0.99,14.99,Trailers,Behind the Scenes
298,EYES DRIVING,A Thrilling Story of a Cat And a Waitress who must Fight a Explorer in The Outback,2006-02-15,172,PG-13,2006,2.99,13.99,Trailers,Commentaries
301,FAMILY SWEET,A Epic Documentary of a Teacher And a Boy who must Escape a Woman in Berlin,2006-02-15,155,R,2006,0.99,24.99,Trailers
304,FARGO GANDHI,A Thrilling Reflection of a Pastry Chef And a Crocodile who must Reach a Teacher in The Outback,2006-02-15,130,G,2006,2.99,28.99,Deleted Scenes
307,FELLOWSHIP AUTUMN,A Lacklusture Reflection of a Dentist And a Hunter who must Meet a Teacher in A Baloon,2006-02-15,77,NC-17,2006,4.99,9.99,Deleted Scenes,Behind the Scenes
310,FEVER EMPIRE,A Insightful Panorama of a Cat And a Boat who must Defeat a Boat in The Gulf of Mexico,2006-02-15,158,R,2006,4.99,20.99,Commentaries,Deleted Scenes
314,FIGHT JAWBREAKER,A Intrepid Panorama of a Womanizer And a Girl who must Escape a Girl in A Manhattan Penthouse,2006-02-15,91,R,2006,0.99,13.99,Trailers,Commentaries,Deleted Scenes,Behind the Scenes
319,FISH OPUS,A Touching Display of a Feminist And a Girl who must Confront a Astronaut in Australia,2006-02-15,125,R,2006,2.99,22.99,Trailers,Deleted Scenes,Behind the Scenes
323,FLIGHT LIES,A Stunning Character Study of a Crocodile And a Pioneer who must Pursue a Teacher in New Orleans,2006-02-15,179,R,2006,4.99,22.99,Trailers
327,FOOL MOCKINGBIRD,A Lacklusture Tale of a Crocodile And a Composer who must Defeat a Madman in A U-Boat,2006-02-15,158,PG,2006,4.99,24.99,Trailers,Commentaries
330,FORRESTER COMANCHEROS,A Fateful Tale of a Squirrel And a Forensic Psychologist who must Redeem a Man in Nigeria,2006-02-15,112,NC-17,2006,4.99,22.99,Trailers,Behind the Scenes
336,FRENCH HOLIDAY,A Thrilling Epistle of a Dog And a Feminist who must Kill a Madman in Berlin,2006-02-15,99,PG,2006,4.99,22.99,Behind the Scenes
339,FROGMEN BREAKING,A Unbelieveable Yarn of a Mad Scientist And a Cat who must Chase a Lumberjack in Australia,2006-02-15,111,R,2006,0.99,17.99,Trailers,Deleted Scenes,Behind the Scenes
343,FULL FLATLINERS,A Beautiful Documentary of a Astronaut And a Moose who must Pursue a Monkey in A Shark Tank,2006-02-15,94,PG,2006,2.99,14.99,Trailers,Deleted Scenes
346,GALAXY SWEETHEARTS,A Emotional Reflection of a Womanizer And a Pioneer who must Face a Squirrel in Berlin,2006-02-15,128,R,2006,4.99,13.99,Deleted Scenes
350,GARDEN ISLAND,A Unbelieveable Character Study of a Womanizer And a Madman who must Reach a Man in The Outback,2006-02-15,80,G,2006,4.99,21.99,Trailers,Behind the Scenes
355,GHOSTBUSTERS ELF,A Thoughtful Epistle of a Dog And a Feminist who must Chase a Composer in Berlin,2006-02-15,101,R,2006,0.99,18.99,Trailers,Deleted Scenes,Behind the Scenes
359,GLADIATOR WESTWARD,A Astounding Reflection of a Squirrel And a Sumo Wrestler who must Sink a Dentist in Ancient Japan,2006-02-15,173,PG,2006,4.99,20.99,Commentaries,Deleted Scenes
363,GO PURPLE,A Fast-Paced Display of a Car And a Database Administrator who must Battle a Woman in A Baloon,2006-02-15,54,R,2006,0.99,12.99,Trailers
367,GOLDMINE TYCOON,A Brilliant Epistle of a Composer And a Frisbee who must Conquer a Husband in The Outback,2006-02-15,153,R,2006,0.99,20.99,Trailers,Behind the Scenes
371,GOSFORD DONNIE,A Epic Panorama of a Mad Scientist And a Monkey who must Redeem a Secret Agent in Berlin,2006-02-15,129,G,2006,4.99,17.99,Commentaries
376,GRAPES FURY,A Boring Yarn of a Mad Cow And a Sumo Wrestler who must Meet a Robot in Australia,2006-02-15,155,G,2006,0.99,20.99,Commentaries,Behind the Scenes
379,GREEDY ROOTS,A Amazing Reflection of a A Shark And a Butler who must Chase a Hunter in The Canadian Rockies,2006-02-15,166,R,2006,0.99,14.99,Trailers,Commentaries,Deleted Scenes
382,GRIT CLOCKWORK,A Thoughtful Display of a Dentist And a Squirrel who must Confront a Lumberjack in A Shark Tank,2006-02-15,137,PG,2006,0.99,21.99,Trailers,Deleted Scenes
384,GROSSE WONDERFUL,A Epic Drama of a Cat And a Explorer who must Redeem a Moose in Australia,2006-02-15,49,R,2006,4.99,19.99,Behind the Scenes
4,AFFAIR PREJUDICE,A Fanciful Documentary of a Frisbee And a Lumberjack who must Chase a Monkey in A Shark Tank,2006-02-15,117,G,2006,2.99,26.99,Commentaries,Behind the Scenes
6,AGENT TRUMAN,A Intrepid Panorama of a Robot And a Boy who must Escape a Sumo Wrestler in Ancient China,2006-02-15,169,PG,2006,2.99,17.99,Deleted Scenes
10,ALADDIN CALENDAR,A Action-Packed Tale of a Man And a Lumberjack who must Reach a Feminist in Ancient China,2006-02-15,63,NC-17,2006,4.99,24.99,Trailers,Deleted Scenes
14,ALICE FANTASIA,A Emotional Drama of a A Shark And a Database Administrator who must Vanquish a Pioneer in Soviet Georgia,2006-02-15,94,NC-17,2006,0.99,23.99,Trailers,Deleted Scenes,Behind the Scenes
17,ALONE TRIP,A Fast-Paced Character Study of a Composer And a Dog who must Outgun a Boat in An Abandoned Fun House,2006-02-15,82,R,2006,0.99,14.99,Trailers,Behind the Scenes
22,AMISTAD MIDSUMMER,A Emotional Character Study of a Dentist And a Crocodile who must Meet a Sumo Wrestler in California,2006-02-15,85,G,2006,2.99,10.99,Commentaries,Behind the Scenes
26,ANNIE IDENTITY,A Amazing Panorama of a Pastry Chef And a Boat who must Escape a Woman in An Abandoned Amusement Park,2006-02-15,86,G,2006,0.99,15.99,Commentaries,Deleted Scenes
30,ANYTHING SAVANNAH,A Epic Story of a Pastry Chef And a Woman who must Chase a Feminist in An Abandoned Fun House,2006-02-15,82,R,2006,2.99,27.99,Trailers,Deleted Scenes,Behind the Scenes
35,ARACHNOPHOBIA ROLLERCOASTER,A Action-Packed Reflection of a Pastry Chef And a Composer who must Discover a Mad Scientist in The First Manned Space Station,2006-02-15,147,PG-13,2006,2.99,24.99,Trailers,Deleted Scenes,Behind the Scenes
38,ARK RIDGEMONT,A Beautiful Yarn of a Pioneer And a Monkey who must Pursue a Explorer in The Sahara Desert,2006-02-15,68,NC-17,2006,0.99,25.99,Trailers,Commentaries,Deleted Scenes,Behind the Scenes
42,ARTIST COLDBLOODED,A Stunning Reflection of a Robot And a Moose who must Challenge a Woman in California,2006-02-15,170,NC-17,2006,2.99,10.99,Trailers,Behind the Scenes
46,AUTUMN CROW,A Beautiful Tale of a Dentist And a Mad Cow who must Battle a Moose in The Sahara Desert,2006-02-15,108,G,2006,4.99,13.99,Trailers,Commentaries,Deleted Scenes,Behind the Scenes
52,BALLROOM MOCKINGBIRD,A Thrilling Documentary of a Composer And a Monkey who must Find a Feminist in California,2006-02-15,173,G,2006,0.99,29.99,Commentaries,Deleted Scenes
56,BAREFOOT MANCHURIAN,A Intrepid Story of a Cat And a Student who must Vanquish a Girl in An Abandoned Amusement Park,2006-02-15,129,G,2006,2.99,15.99,Trailers,Commentaries
59,BEAR GRACELAND,A Astounding Saga of a Dog And a Boy who must Kill a Teacher in The First Manned Space Station,2006-02-15,160,R,2006,2.99,20.99,Deleted Scenes
63,BEDAZZLED MARRIED,A Astounding Character Study of a Madman And a Robot who must Meet a Mad Scientist in An Abandoned Fun House,2006-02-15,73,PG,2006,0.99,21.99,Trailers,Deleted Scenes,Behind the Scenes
67,BERETS AGENT,A Taut Saga of a Crocodile And a Boy who must Overcome a Technical Writer in Ancient China,2006-02-15,77,PG-13,2006,2.99,24.99,Deleted Scenes
71,BILKO ANONYMOUS,A Emotional Reflection of a Teacher And a Man who must Meet a Cat in The First Manned Space Station,2006-02-15,100,PG-13,2006,4.99,25.99,Commentaries,Deleted Scenes,Behind the Scenes
75,BIRD INDEPENDENCE,A Thrilling Documentary of a Car And a Student who must Sink a Hunter in The Canadian Rockies,2006-02-15,163,G,2006,4.99,14.99,Commentaries,Behind the Scenes
79,BLADE POLISH,A Thoughtful Character Study of a Frisbee And a Pastry Chef who must Fight a Dentist in The First Manned Space Station,2006-02-15,114,PG-13,2006,0.99,10.99,Trailers,Behind the Scenes
83,BLUES INSTINCT,A Insightful Documentary of a Boat And a Composer who must Meet a Forensic Psychologist in An Abandoned Fun House,2006-02-15,50,G,2006,2.99,18.99,Trailers,Deleted Scenes,Behind the Scenes
87,BOONDOCK BALLROOM,A Fateful Panorama of a Crocodile And a Boy who must Defeat a Monkey in The Gulf of Mexico,2006-02-15,76,NC-17,2006,0.99,14.99,Behind the Scenes
91,BOUND CHEAPER,A Thrilling Panorama of a Database Administrator And a Astronaut who must Challenge a Lumberjack in A Baloon,2006-02-15,98,PG,2006,0.99,17.99,Behind the Scenes
95,BREAKFAST GOLDFINGER,A Beautiful Reflection of a Student And a Student who must Fight a Moose in Berlin,2006-02-15,123,G,2006,4.99,18.99,Trailers,Commentaries,Deleted Scenes
99,BRINGING HYSTERICAL,A Fateful Saga of a A Shark And a Technical Writer who must Find a Woman in A Jet Boat,2006-02-15,136,PG,2006,2.99,14.99,Trailers
104,BUGSY SONG,A Awe-Inspiring Character Study of a Secret Agent And a Boat who must Find a Squirrel in The First Manned Space Station,2006-02-15,119,G,2006,2.99,17.99,Commentaries
108,BUTCH PANTHER,A Lacklusture Yarn of a Feminist And a Database Administrator who must Face a Hunter in New Orleans,2006-02-15,67,PG-13,2006,0.99,19.99,Trailers,Commentaries,Deleted Scenes
112,CALENDAR GUNFIGHT,A Thrilling Drama of a Frisbee And a Lumberjack who must Sink a Man in Nigeria,2006-02-15,120,NC-17,2006,4.99,22.99,Trailers,Commentaries,Behind the Scenes
118,CANYON STOCK,A Thoughtful Reflection of a Waitress And a Feminist who must Escape a Squirrel in A Manhattan Penthouse,2006-02-15,85,R,2006,0.99,26.99,Trailers,Deleted Scenes
120,CARIBBEAN LIBERTY,A Fanciful Tale of a Pioneer And a Technical Writer who must Outgun a Pioneer in A Shark Tank,2006-02-15,92,NC-17,2006,4.99,16.99,Commentaries,Deleted Scenes
124,CASPER DRAGONFLY,A Intrepid Documentary of a Boat And a Crocodile who must Chase a Robot in The Sahara Desert,2006-02-15,163,PG-13,2006,4.99,16.99,Trailers
128,CATCH AMISTAD,A Boring Reflection of a Lumberjack And a Feminist who must Discover a Woman in Nigeria,2006-02-15,183,G,2006,0.99,10.99,Trailers,Behind the Scenes
135,CHANCE RESURRECTION,A Astounding Story of a Forensic Psychologist And a Forensic Psychologist who must Overcome a Moose in Ancient China,2006-02-15,70,R,2006,2.99,22.99,Commentaries,Deleted Scenes,Behind the Scenes
139,CHASING FIGHT,A Astounding Saga of a Technical Writer And a Butler who must Battle a Butler in A Shark Tank,2006-02-15,114,PG,2006,4.99,21.99,Trailers,Commentaries
143,CHILL LUCK,A Lacklusture Epistle of a Boat And a Technical Writer who must Fight a A Shark in The Canadian Rockies,2006-02-15,142,PG,2006,0.99,17.99,Trailers,Commentaries,Deleted Scenes
147,CHOCOLAT HARRY,A Action-Packed Epistle of a Dentist And a Moose who must Meet a Mad Cow in Ancient Japan,2006-02-15,101,NC-17,2006,0.99,16.99,Commentaries,Behind the Scenes
151,CINCINATTI WHISPERER,A Brilliant Saga of a Pastry Chef And a Hunter who must Confront a Butler in Berlin,2006-02-15,143,NC-17,2006,4.99,26.99,Deleted Scenes
155,CLEOPATRA DEVIL,A Fanciful Documentary of a Crocodile And a Technical Writer who must Fight a A Shark in A Baloon,2006-02-15,150,PG-13,2006,0.99,26.99,Trailers,Deleted Scenes,Behind the Scenes
159,CLOSER BANG,A Unbelieveable Panorama of a Frisbee And a Hunter who must Vanquish a Monkey in Ancient India,2006-02-15,58,R,2006,4.99,12.99,Trailers,Behind the Scenes
163,CLYDE THEORY,A Beautiful Yarn of a Astronaut And a Frisbee who must Overcome a Explorer in A Jet Boat,2006-02-15,139,PG-13,2006,0.99,29.99,Commentaries,Deleted Scenes,Behind the Scenes
167,COMA HEAD,A Awe-Inspiring Drama of a Boy And a Frisbee who must Escape a Pastry Chef in California,2006-02-15,109,NC-17,2006,4.99,10.99,Commentaries
171,COMMANDMENTS EXPRESS,A Fanciful Saga of a Student And a Mad Scientist who must Battle a Hunter in An Abandoned Mine Shaft,2006-02-15,59,R,2006,4.99,13.99,Trailers,Commentaries,Deleted Scenes
176,CONGENIALITY QUEST,A Touching Documentary of a Cat And a Pastry Chef who must Find a Lumberjack in A Baloon,2006-02-15,87,PG-13,2006,0.99,21.99,Commentaries,Behind the Scenes
180,CONSPIRACY SPIRIT,A Awe-Inspiring Story of a Student And a Frisbee who must Conquer a Crocodile in An Abandoned Mine Shaft,2006-02-15,184,PG-13,2006,2.99,27.99,Trailers,Commentaries
184,CORE SUIT,A Unbelieveable Tale of a Car And a Explorer who must Confront a Boat in A Manhattan Penthouse,2006-02-15,92,PG-13,2006,2.99,24.99,Deleted Scenes
187,CRANES RESERVOIR,A Fanciful Documentary of a Teacher And a Dog who must Outgun a Forensic Psychologist in A Baloon Factory,2006-02-15,57,NC-17,2006,2.99,12.99,Commentaries
