584,MIXED DOORS,A Taut Drama of a Womanizer And a Lumberjack who must Succumb a Pioneer in Ancient India,2006-02-15,180,PG-13,2006,2.99,26.99,Behind the Scenes
585,MOB DUFFEL,A Unbelieveable Documentary of a Frisbee And a Boat who must Meet a Boy in The Canadian Rockies,2006-02-15,105,G,2006,0.99,25.99,Trailers
586,MOCKINGBIRD HOLLYWOOD,A Thoughtful Panorama of a Man And a Car who must Sink a Composer in Berlin,2006-02-15,60,PG,2006,0.99,27.99,Behind the Scenes
587,MOD SECRETARY,A Boring Documentary of a Mad Cow And a Cat who must Build a Lumberjack in New Orleans,2006-02-15,77,NC-17,2006,4.99,20.99,Commentaries,Behind the Scenes
588,MODEL FISH,A Beautiful Panorama of a Boat And a Crocodile who must Outrace a Dog in Australia,2006-02-15,175,NC-17,2006,4.99,11.99,Trailers,Commentaries,Behind the Scenes
589,MODERN DORADO,A Awe-Inspiring Story of a Butler And a Sumo Wrestler who must Redeem a Boy in New Orleans,2006-02-15,74,PG,2006,0.99,20.99,Trailers,Commentaries,Deleted Scenes
590,MONEY HAROLD,A Touching Tale of a Explorer And a Boat who must Defeat a Robot in Australia,2006-02-15,135,PG,2006,2.99,17.99,Trailers,Commentaries
591,MONSOON CAUSE,A Astounding Tale of a Crocodile And a Car who must Outrace a Squirrel in A U-Boat,2006-02-15,182,PG,2006,4.99,20.99,Commentaries,Behind the Scenes
592,MONSTER SPARTACUS,A Fast-Paced Story of a Waitress And a Cat who must Fight a Girl in Australia,2006-02-15,107,PG,2006,2.99,28.99,Commentaries,Behind the Scenes
593,MONTEREY LABYRINTH,A Awe-Inspiring Drama of a Monkey And a Composer who must Escape a Feminist in A U-Boat,2006-02-15,158,G,2006,0.99,13.99,Trailers,Commentaries
594,MONTEZUMA COMMAND,A Thrilling Reflection of a Waitress And a Butler who must Battle a Butler in A Jet Boat,2006-02-15,126,NC-17,2006,0.99,22.99,Trailers
595,MOON BUNCH,A Beautiful Tale of a Astronaut And a Mad Cow who must Challenge a Cat in A Baloon Factory,2006-02-15,83,PG,2006,0.99,20.99,Deleted Scenes,Behind the Scenes
596,MOONSHINE CABIN,A Thoughtful Display of a Astronaut And a Feminist who must Chase a Frisbee in A Jet Boat,2006-02-15,171,PG-13,2006,4.99,25.99,Behind the Scenes
597,MOONWALKER FOOL,A Epic Drama of a Feminist And a Pioneer who must Sink a Composer in New Orleans,2006-02-15,184,G,2006,4.99,12.99,Trailers,Deleted Scenes
598,MOSQUITO ARMAGEDDON,A Thoughtful Character Study of a Waitress And a Feminist who must Build a Teacher in Ancient Japan,2006-02-15,57,G,2006,0.99,22.99,Trailers
599,MOTHER OLEANDER,A Boring Tale of a Husband And a Boy who must Fight a Squirrel in Ancient China,2006-02-15,103,R,2006,0.99,20.99,Trailers,Commentaries
600,MOTIONS DETAILS,A Awe-Inspiring Reflection of a Dog And a Student who must Kill a Car in An Abandoned Fun House,2006-02-15,166,PG,2006,0.99,16.99,Trailers,Commentaries,Behind the Scenes
601,MOULIN WAKE,A Astounding Story of a Forensic Psychologist And a Cat who must Battle a Teacher in An Abandoned Mine Shaft,2006-02-15,79,PG-13,2006,0.99,20.99,Trailers
602,MOURNING PURPLE,A Lacklusture Display of a Waitress And a Lumberjack who must Chase a Pioneer in New Orleans,2006-02-15,146,PG,2006,0.99,14.99,Trailers,Commentaries,Deleted Scenes,Behind the Scenes
603,MOVIE SHAKESPEARE,A Insightful Display of a Database Administrator And a Student who must Build a Hunter in Berlin,2006-02-15,53,PG,2006,4.99,27.99,Commentaries,Deleted Scenes,Behind the Scenes
604,MULAN MOON,A Emotional Saga of a Womanizer And a Pioneer who must Overcome a Dentist in A Baloon,2006-02-15,160,G,2006,0.99,10.99,Behind the Scenes
605,MULHOLLAND BEAST,A Awe-Inspiring Display of a Husband And a Squirrel who must Battle a Sumo Wrestler in A Jet Boat,2006-02-15,157,PG,2006,2.99,13.99,Trailers,Deleted Scenes,Behind the Scenes
606,MUMMY CREATURES,A Fateful Character Study of a Crocodile And a Monkey who must Meet a Dentist in Australia,2006-02-15,160,NC-17,2006,0.99,15.99,Trailers,Behind the Scenes
607,MUPPET MILE,A Lacklusture Story of a Madman And a Teacher who must Kill a Frisbee in The Gulf of Mexico,2006-02-15,50,PG,2006,4.99,18.99,Trailers,Deleted Scenes
608,MURDER ANTITRUST,A Brilliant Yarn of a Car And a Database Administrator who must Escape a Boy in A MySQL Convention,2006-02-15,166,PG,2006,2.99,11.99,Trailers,Deleted Scenes,Behind the Scenes
609,MUSCLE BRIGHT,A Stunning Panorama of a Sumo Wrestler And a Husband who must Redeem a Madman in Ancient India,2006-02-15,185,G,2006,2.99,23.99,Deleted Scenes
610,MUSIC BOONDOCK,A Thrilling Tale of a Butler And a Astronaut who must Battle a Explorer in The First Manned Space Station,2006-02-15,129,R,2006,0.99,17.99,Trailers,Commentaries,Behind the Scenes
611,MUSKETEERS WAIT,A Touching Yarn of a Student And a Moose who must Fight a Mad Cow in Australia,2006-02-15,73,PG,2006,4.99,17.99,Deleted Scenes,Behind the Scenes
612,MUSSOLINI SPOILERS,A Thrilling Display of a Boat And a Monkey who must Meet a Composer in Ancient China,2006-02-15,180,G,2006,2.99,10.99,Deleted Scenes,Behind the Scenes
613,MYSTIC TRUMAN,A Epic Yarn of a Teacher And a Hunter who must Outgun a Explorer in Soviet Georgia,2006-02-15,92,NC-17,2006,0.99,19.99,Commentaries,Behind the Scenes
614,NAME DETECTIVE,A Touching Saga of a Sumo Wrestler And a Cat who must Pursue a Mad Scientist in Nigeria,2006-02-15,178,PG-13,2006,4.99,11.99,Trailers,Commentaries,Behind the Scenes
615,NASH CHOCOLAT,A Epic Reflection of a Monkey And a Mad Cow who must Kill a Forensic Psychologist in An Abandoned Mine Shaft,2006-02-15,180,PG-13,2006,2.99,21.99,Commentaries,Behind the Scenes
616,NATIONAL STORY,A Taut Epistle of a Mad Scientist And a Girl who must Escape a Monkey in California,2006-02-15,92,NC-17,2006,2.99,19.99,Trailers
617,NATURAL STOCK,A Fast-Paced Story of a Sumo Wrestler And a Girl who must Defeat a Car in A Baloon Factory,2006-02-15,50,PG-13,2006,0.99,24.99,Commentaries,Deleted Scenes
618,NECKLACE OUTBREAK,A Astounding Epistle of a Database Administrator And a Mad Scientist who must Pursue a Cat in California,2006-02-15,132,PG,2006,0.99,21.99,Trailers,Commentaries,Behind the Scenes
619,NEIGHBORS CHARADE,A Fanciful Reflection of a Crocodile And a Astronaut who must Outrace a Feminist in An Abandoned Amusement Park,2006-02-15,161,R,2006,0.99,20.99,Trailers,Commentaries,Deleted Scenes
620,NEMO CAMPUS,A Lacklusture Reflection of a Monkey And a Squirrel who must Outrace a Womanizer in A Manhattan Penthouse,2006-02-15,131,NC-17,2006,2.99,23.99,Trailers
621,NETWORK PEAK,A Unbelieveable Reflection of a Butler And a Boat who must Outgun a Mad Scientist in California,2006-02-15,75,PG-13,2006,2.99,23.99,Commentaries,Deleted Scenes,Behind the Scenes
622,NEWSIES STORY,A Action-Packed Character Study of a Dog And a Lumberjack who must Outrace a Moose in The Gulf of Mexico,2006-02-15,159,G,2006,0.99,25.99,Trailers,Deleted Scenes
623,NEWTON LABYRINTH,A Intrepid Character Study of a Moose And a Waitress who must Find a A Shark in Ancient India,2006-02-15,75,PG,2006,0.99,9.99,Trailers,Commentaries,Deleted Scenes,Behind the Scenes
624,NIGHTMARE CHILL,A Brilliant Display of a Robot And a Butler who must Fight a Waitress in An Abandoned Mine Shaft,2006-02-15,149,PG,2006,4.99,25.99,Trailers,Deleted Scenes,Behind the Scenes
625,NONE SPIKING,A Boring Reflection of a Secret Agent And a Astronaut who must Face a Composer in A Manhattan Penthouse,2006-02-15,83,NC-17,2006,0.99,18.99,Trailers,Commentaries
626,NOON PAPI,A Unbelieveable Character Study of a Mad Scientist And a Astronaut who must Find a Pioneer in A Manhattan Penthouse,2006-02-15,57,G,2006,2.99,12.99,Behind the Scenes
627,NORTH TEQUILA,A Beautiful Character Study of a Mad Cow And a Robot who must Reach a Womanizer in New Orleans,2006-02-15,67,NC-17,2006,4.99,9.99,Commentaries,Deleted Scenes,Behind the Scenes
628,NORTHWEST POLISH,A Boring Character Study of a Boy And a A Shark who must Outrace a Womanizer in The Outback,2006-02-15,172,PG,2006,2.99,24.99,Trailers
629,NOTORIOUS REUNION,A Amazing Epistle of a Woman And a Squirrel who must Fight a Hunter in A Baloon,2006-02-15,128,NC-17,2006,0.99,9.99,Trailers,Commentaries,Deleted Scenes
630,NOTTING SPEAKEASY,A Thoughtful Display of a Butler And a Womanizer who must Find a Waitress in The Canadian Rockies,2006-02-15,48,PG-13,2006,0.99,19.99,Trailers,Commentaries
631,NOVOCAINE FLIGHT,A Fanciful Display of a Student And a Teacher who must Outgun a Crocodile in Nigeria,2006-02-15,64,G,2006,0.99,11.99,Trailers,Commentaries,Deleted Scenes
632,NUTS TIES,A Thoughtful Drama of a Explorer And a Womanizer who must Meet a Teacher in California,2006-02-15,145,NC-17,2006,4.99,10.99,Trailers,Behind the Scenes
633,OCTOBER SUBMARINE,A Taut Epistle of a Monkey And a Boy who must Confront a Husband in A Jet Boat,2006-02-15,54,PG-13,2006,4.99,10.99,Trailers,Commentaries,Behind the Scenes
634,ODDS BOOGIE,A Thrilling Yarn of a Feminist And a Madman who must Battle a Hunter in Berlin,2006-02-15,48,NC-17,2006,0.99,14.99,Trailers,Commentaries,Behind the Scenes
635,OKLAHOMA JUMANJI,A Thoughtful Drama of a Dentist And a Womanizer who must Meet a Husband in The Sahara Desert,2006-02-15,58,PG,2006,0.99,15.99,Behind the Scenes
636,OLEANDER CLUE,A Boring Story of a Teacher And a Monkey who must Succumb a Forensic Psychologist in A Jet Boat,2006-02-15,161,PG,2006,0.99,12.99,Commentaries,Deleted Scenes
637,OPEN AFRICAN,A Lacklusture Drama of a Secret Agent And a Explorer who must Discover a Car in A U-Boat,2006-02-15,131,PG,2006,4.99,16.99,Trailers,Commentaries
638,OPERATION OPERATION,A Intrepid Character Study of a Man And a Frisbee who must Overcome a Madman in Ancient China,2006-02-15,156,G,2006,2.99,23.99,Trailers,Commentaries,Deleted Scenes,Behind the Scenes
639,OPPOSITE NECKLACE,A Fateful Epistle of a Crocodile And a Moose who must Kill a Explorer in Nigeria,2006-02-15,92,PG,2006,4.99,9.99,Deleted Scenes
640,OPUS ICE,A Fast-Paced Drama of a Hunter And a Boy who must Discover a Feminist in The Sahara Desert,2006-02-15,102,R,2006,4.99,21.99,Commentaries,Deleted Scenes
641,ORANGE GRAPES,A Astounding Documentary of a Butler And a Womanizer who must Face a Dog in A U-Boat,2006-02-15,76,PG-13,2006,0.99,21.99,Trailers,Commentaries
642,ORDER BETRAYED,A Amazing Saga of a Dog And a A Shark who must Challenge a Cat in The Sahara Desert,2006-02-15,120,PG-13,2006,2.99,13.99,Deleted Scenes,Behind the Scenes
643,ORIENT CLOSER,A Astounding Epistle of a Technical Writer And a Teacher who must Fight a Squirrel in The Sahara Desert,2006-02-15,118,R,2006,2.99,22.99,Commentaries,Deleted Scenes
644,OSCAR GOLD,A Insightful Tale of a Database Administrator And a Dog who must Face a Madman in Soviet Georgia,2006-02-15,115,PG,2006,2.99,29.99,Behind the Scenes
645,OTHERS SOUP,A Lacklusture Documentary of a Mad Cow And a Madman who must Sink a Moose in The Gulf of Mexico,2006-02-15,118,PG,2006,2.99,18.99,Deleted Scenes
646,OUTBREAK DIVINE,A Unbelieveable Yarn of a Database Administrator And a Woman who must Succumb a A Shark in A U-Boat,2006-02-15,169,NC-17,2006,0.99,12.99,Trailers,Deleted Scenes,Behind the Scenes
647,OUTFIELD MASSACRE,A Thoughtful Drama of a Husband And a Secret Agent who must Pursue a Database Administrator in Ancient India,2006-02-15,129,NC-17,2006,0.99,18.99,Trailers,Deleted Scenes
648,OUTLAW HANKY,A Thoughtful Story of a Astronaut And a Composer who must Conquer a Dog in The Sahara Desert,2006-02-15,148,PG-13,2006,4.99,17.99,Trailers,Commentaries
649,OZ LIAISONS,A Epic Yarn of a Mad Scientist And a Cat who must Confront a Womanizer in A Baloon Factory,2006-02-15,85,R,2006,2.99,14.99,Commentaries,Deleted Scenes,Behind the Scenes
650,PACIFIC AMISTAD,A Thrilling Yarn of a Dog And a Moose who must Kill a Pastry Chef in A Manhattan Penthouse,2006-02-15,144,G,2006,0.99,27.99,Trailers,Commentaries,Deleted Scenes,Behind the Scenes
651,PACKER MADIGAN,A Epic Display of a Sumo Wrestler And a Forensic Psychologist who must Build a Woman in An Abandoned Amusement Park,2006-02-15,84,PG-13,2006,0.99,20.99,Trailers
652,PAJAMA JAWBREAKER,A Emotional Drama of a Boy And a Technical Writer who must Redeem a Sumo Wrestler in California,2006-02-15,126,R,2006,0.99,14.99,Trailers,Deleted Scenes
653,PANIC CLUB,A Fanciful Display of a Teacher And a Crocodile who must Succumb a Girl in A Baloon,2006-02-15,102,G,2006,4.99,15.99,Commentaries,Deleted Scenes
654,PANKY SUBMARINE,A Touching Documentary of a Dentist And a Sumo Wrestler who must Overcome a Boy in The Gulf of Mexico,2006-02-15,93,G,2006,4.99,19.99,Trailers,Commentaries,Deleted Scenes,Behind the Scenes
655,PANTHER REDS,A Brilliant Panorama of a Moose And a Man who must Reach a Teacher in The Gulf of Mexico,2006-02-15,109,NC-17,2006,4.99,22.99,Deleted Scenes,Behind the Scenes
656,PAPI NECKLACE,A Fanciful Display of a Car And a Monkey who must Escape a Squirrel in Ancient Japan,2006-02-15,128,PG,2006,0.99,9.99,Trailers,Deleted Scenes,Behind the Scenes
657,PARADISE SABRINA,A Intrepid Yarn of a Car And a Moose who must Outrace a Crocodile in A Manhattan Penthouse,2006-02-15,48,PG-13,2006,2.99,12.99,Commentaries,Deleted Scenes,Behind the Scenes
658,PARIS WEEKEND,A Intrepid Story of a Squirrel And a Crocodile who must Defeat a Monkey in The Outback,2006-02-15,121,PG-13,2006,2.99,19.99,Trailers,Commentaries,Deleted Scenes,Behind the Scenes
659,PARK CITIZEN,A Taut Epistle of a Sumo Wrestler And a Girl who must Face a Husband in Ancient Japan,2006-02-15,109,PG-13,2006,4.99,14.99,Trailers,Deleted Scenes
660,PARTY KNOCK,A Fateful Display of a Technical Writer And a Butler who must Battle a Sumo Wrestler in An Abandoned Mine Shaft,2006-02-15,107,PG,2006,2.99,11.99,Trailers,Behind the Scenes
661,PAST SUICIDES,A Intrepid Tale of a Madman And a Astronaut who must Challenge a Hunter in A Monastery,2006-02-15,157,PG-13,2006,4.99,17.99,Trailers,Deleted Scenes,Behind the Scenes
662,PATHS CONTROL,A Astounding Documentary of a Butler And a Cat who must Find a Frisbee in Ancient China,2006-02-15,118,PG,2006,4.99,9.99,Trailers,Behind the Scenes
663,PATIENT SISTER,A Emotional Epistle of a Squirrel And a Robot who must Confront a Lumberjack in Soviet Georgia,2006-02-15,99,NC-17,2006,0.99,29.99,Trailers,Commentaries
664,PATRIOT ROMAN,A Taut Saga of a Robot And a Database Administrator who must Challenge a Astronaut in California,2006-02-15,65,PG,2006,2.99,12.99,Trailers,Deleted Scenes
665,PATTON INTERVIEW,A Thrilling Documentary of a Composer And a Secret Agent who must Succumb a Cat in Berlin,2006-02-15,175,PG,2006,2.99,22.99,Commentaries
666,PAYCHECK WAIT,A Awe-Inspiring Reflection of a Boy And a Man who must Discover a Moose in The Sahara Desert,2006-02-15,145,PG-13,2006,4.99,27.99,Commentaries,Deleted Scenes
667,PEACH INNOCENT,A Action-Packed Drama of a Monkey And a Dentist who must Chase a Butler in Berlin,2006-02-15,160,PG-13,2006,2.99,20.99,Commentaries,Behind the Scenes
668,PEAK FOREVER,A Insightful Reflection of a Boat And a Secret Agent who must Vanquish a Astronaut in An Abandoned Mine Shaft,2006-02-15,80,PG,2006,4.99,25.99,Trailers,Commentaries,Deleted Scenes,Behind the Scenes
669,PEARL DESTINY,A Lacklusture Yarn of a Astronaut And a Pastry Chef who must Sink a Dog in A U-Boat,2006-02-15,74,NC-17,2006,2.99,10.99,Trailers
670,PELICAN COMFORTS,A Epic Documentary of a Boy And a Monkey who must Pursue a Astronaut in Berlin,2006-02-15,48,PG,2006,4.99,17.99,Commentaries,Deleted Scenes
671,PERDITION FARGO,A Fast-Paced Story of a Car And a Cat who must Outgun a Hunter in Berlin,2006-02-15,99,NC-17,2006,4.99,27.99,Trailers,Behind the Scenes
672,PERFECT GROOVE,A Thrilling Yarn of a Dog And a Dog who must Build a Husband in A Baloon,2006-02-15,82,PG-13,2006,2.99,17.99,Commentaries,Deleted Scenes,Behind the Scenes
673,PERSONAL LADYBUGS,A Epic Saga of a Hunter And a Technical Writer who must Conquer a Cat in Ancient Japan,2006-02-15,118,PG-13,2006,0.99,19.99,Deleted Scenes,Behind the Scenes
674,PET HAUNTING,A Unbelieveable Reflection of a Explorer And a Boat who must Conquer a Woman in California,2006-02-15,99,PG,2006,0.99,11.99,Trailers,Commentaries
675,PHANTOM GLORY,A Beautiful Documentary of a Astronaut And a Crocodile who must Discover a Madman in A Monastery,2006-02-15,60,NC-17,2006,2.99,17.99,Commentaries,Behind the Scenes
676,PHILADELPHIA WIFE,A Taut Yarn of a Hunter And a Astronaut who must Conquer a Database Administrator in The Sahara Desert,2006-02-15,137,PG-13,2006,4.99,16.99,Trailers,Commentaries,Deleted Scenes
677,PIANIST OUTFIELD,A Intrepid Story of a Boy And a Technical Writer who must Pursue a Lumberjack in A Monastery,2006-02-15,136,NC-17,2006,0.99,25.99,Trailers,Commentaries,Deleted Scenes
678,PICKUP DRIVING,A Touching Documentary of a Husband And a Boat who must Meet a Pastry Chef in A Baloon Factory,2006-02-15,77,G,2006,2.99,23.99,Trailers,Commentaries,Deleted Scenes,Behind the Scenes
679,PILOT HOOSIERS,A Awe-Inspiring Reflection of a Crocodile And a Sumo Wrestler who must Meet a Forensic Psychologist in An Abandoned Mine Shaft,2006-02-15,50,PG,2006,2.99,17.99,Trailers,Deleted Scenes
680,PINOCCHIO SIMON,A Action-Packed Reflection of a Mad Scientist And a A Shark who must Find a Feminist in California,2006-02-15,103,PG,2006,4.99,21.99,Commentaries,Behind the Scenes
681,PIRATES ROXANNE,A Stunning Drama of a Woman And a Lumberjack who must Overcome a A Shark in The Canadian Rockies,2006-02-15,100,PG,2006,0.99,20.99,Commentaries,Deleted Scenes
682,PITTSBURGH HUNCHBACK,A Thrilling Epistle of a Boy And a Boat who must Find a Student in Soviet Georgia,2006-02-15,134,PG-13,2006,4.99,17.99,Trailers,Deleted Scenes,Behind the Scenes
683,PITY BOUND,A Boring Panorama of a Feminist And a Moose who must Defeat a Database Administrator in Nigeria,2006-02-15,60,NC-17,2006,4.99,19.99,Commentaries
684,PIZZA JUMANJI,A Epic Saga of a Cat And a Squirrel who must Outgun a Robot in A U-Boat,2006-02-15,173,NC-17,2006,2.99,11.99,Commentaries
685,PLATOON INSTINCT,A Thrilling Panorama of a Man And a Woman who must Reach a Woman in Australia,2006-02-15,132,PG-13,2006,4.99,10.99,Trailers,Commentaries
686,PLUTO OLEANDER,A Action-Packed Reflection of a Car And a Moose who must Outgun a Car in A Shark Tank,2006-02-15,84,R,2006,4.99,9.99,Behind the Scenes
687,POCUS PULP,A Intrepid Yarn of a Frisbee And a Dog who must Build a Astronaut in A Baloon Factory,2006-02-15,138,NC-17,2006,0.99,15.99,Commentaries,Deleted Scenes,Behind the Scenes
688,POLISH BROOKLYN,A Boring Character Study of a Database Administrator And a Lumberjack who must Reach a Madman in The Outback,2006-02-15,61,PG,2006,0.99,12.99,Trailers,Commentaries,Deleted Scenes,Behind the Scenes
689,POLLOCK DELIVERANCE,A Intrepid Story of a Madman And a Frisbee who must Outgun a Boat in The Sahara Desert,2006-02-15,137,PG,2006,2.99,14.99,Commentaries
690,POND SEATTLE,A Stunning Drama of a Teacher And a Boat who must Battle a Feminist in Ancient China,2006-02-15,185,PG-13,2006,2.99,25.99,Trailers,Commentaries,Behind the Scenes
691,POSEIDON FOREVER,A Thoughtful Epistle of a Womanizer And a Monkey who must Vanquish a Dentist in A Monastery,2006-02-15,159,PG-13,2006,4.99,29.99,Commentaries
692,POTLUCK MIXED,A Beautiful Story of a Dog And a Technical Writer who must Outgun a Student in A Baloon,2006-02-15,179,G,2006,2.99,10.99,Behind the Scenes
693,POTTER CONNECTICUT,A Thrilling Epistle of a Frisbee And a Cat who must Fight a Technical Writer in Berlin,2006-02-15,115,PG,2006,2.99,16.99,Trailers,Commentaries
694,PREJUDICE OLEANDER,A Epic Saga of a Boy And a Dentist who must Outrace a Madman in A U-Boat,2006-02-15,98,PG-13,2006,4.99,15.99,Trailers,Commentaries,Deleted Scenes
695,PRESIDENT BANG,A Fateful Panorama of a Technical Writer And a Moose who must Battle a Robot in Soviet Georgia,2006-02-15,144,PG,2006,4.99,12.99,Behind the Scenes
696,PRIDE ALAMO,A Thoughtful Drama of a A Shark And a Forensic Psychologist who must Vanquish a Student in Ancient India,2006-02-15,114,NC-17,2006,0.99,20.99,Deleted Scenes
697,PRIMARY GLASS,A Fateful Documentary of a Pastry Chef And a Butler who must Build a Dog in The Canadian Rockies,2006-02-15,53,G,2006,0.99,16.99,Trailers,Deleted Scenes,Behind the Scenes
698,PRINCESS GIANT,A Thrilling Yarn of a Pastry Chef And a Monkey who must Battle a Monkey in A Shark Tank,2006-02-15,71,NC-17,2006,2.99,29.99,Trailers,Deleted Scenes
699,PRIVATE DROP,A Stunning Story of a Technical Writer And a Hunter who must Succumb a Secret Agent in A Baloon,2006-02-15,106,PG,2006,4.99,26.99,Trailers
700,PRIX UNDEFEATED,A Stunning Saga of a Mad Scientist And a Boat who must Overcome a Dentist in Ancient China,2006-02-15,115,R,2006,2.99,13.99,Trailers,Deleted Scenes
701,PSYCHO SHRUNK,A Amazing Panorama of a Crocodile And a Explorer who must Fight a Husband in Nigeria,2006-02-15,155,PG-13,2006,2.99,11.99,Behind the Scenes
702,PULP BEVERLY,A Unbelieveable Display of a Dog And a Crocodile who must Outrace a Man in Nigeria,2006-02-15,89,G,2006,2.99,12.99,Trailers,Behind the Scenes
703,PUNK DIVORCE,A Fast-Paced Tale of a Pastry Chef And a Boat who must Face a Frisbee in The Canadian Rockies,2006-02-15,100,PG,2006,4.99,18.99,Trailers,Commentaries,Deleted Scenes
704,PURE RUNNER,A Thoughtful Documentary of a Student And a Madman who must Challenge a Squirrel in A Manhattan Penthouse,2006-02-15,121,NC-17,2006,2.99,25.99,Trailers,Deleted Scenes
705,PURPLE MOVIE,A Boring Display of a Pastry Chef And a Sumo Wrestler who must Discover a Frisbee in An Abandoned Amusement Park,2006-02-15,88,R,2006,2.99,9.99,Commentaries,Deleted Scenes
706,QUEEN LUKE,A Astounding Story of a Girl And a Boy who must Challenge a Composer in New Orleans,2006-02-15,163,PG,2006,4.99,22.99,Commentaries,Deleted Scenes,Behind the Scenes
707,QUEST MUSSOLINI,A Fateful Drama of a Husband And a Sumo Wrestler who must Battle a Pastry Chef in A Baloon Factory,2006-02-15,177,R,2006,2.99,29.99,Behind the Scenes
708,QUILLS BULL,A Thoughtful Story of a Pioneer And a Woman who must Reach a Moose in Australia,2006-02-15,112,R,2006,4.99,19.99,Trailers,Behind the Scenes
709,RACER EGG,A Emotional Display of a Monkey And a Waitress who must Reach a Secret Agent in California,2006-02-15,147,NC-17,2006,2.99,19.99,Trailers,Commentaries,Deleted Scenes
710,RAGE GAMES,A Fast-Paced Saga of a Astronaut And a Secret Agent who must Escape a Hunter in An Abandoned Amusement Park,2006-02-15,120,R,2006,4.99,18.99,Trailers,Behind the Scenes
711,RAGING AIRPLANE,A Astounding Display of a Secret Agent And a Technical Writer who must Escape a Mad Scientist in A Jet Boat,2006-02-15,154,R,2006,4.99,18.99,Commentaries,Deleted Scenes
712,RAIDERS ANTITRUST,A Amazing Drama of a Teacher And a Feminist who must Meet a Woman in The First Manned Space Station,2006-02-15,82,PG-13,2006,0.99,11.99,Deleted Scenes
713,RAINBOW SHOCK,A Action-Packed Story of a Hunter And a Boy who must Discover a Lumberjack in Ancient India,2006-02-15,74,PG,2006,4.99,14.99,Trailers,Commentaries,Deleted Scenes,Behind the Scenes
714,RANDOM GO,A Fateful Drama of a Frisbee And a Student who must Confront a Cat in A Shark Tank,2006-02-15,73,NC-17,2006,2.99,29.99,Trailers
715,RANGE MOONWALKER,A Insightful Documentary of a Hunter And a Dentist who must Confront a Crocodile in A Baloon,2006-02-15,147,PG,2006,4.99,25.99,Trailers,Commentaries,Deleted Scenes
716,REAP UNFAITHFUL,A Thrilling Epistle of a Composer And a Sumo Wrestler who must Challenge a Mad Cow in A MySQL Convention,2006-02-15,136,PG-13,2006,2.99,26.99,Trailers,Commentaries
717,REAR TRADING,A Awe-Inspiring Reflection of a Forensic Psychologist And a Secret Agent who must Succumb a Pastry Chef in Soviet Georgia,2006-02-15,97,NC-17,2006,0.99,23.99,Trailers,Commentaries,Deleted Scenes
718,REBEL AIRPORT,A Intrepid Yarn of a Database Administrator And a Boat who must Outrace a Husband in Ancient India,2006-02-15,73,G,2006,0.99,24.99,Trailers,Behind the Scenes
719,RECORDS ZORRO,A Amazing Drama of a Mad Scientist And a Composer who must Build a Husband in The Outback,2006-02-15,182,PG,2006,4.99,11.99,Behind the Scenes
720,REDEMPTION COMFORTS,A Emotional Documentary of a Dentist And a Woman who must Battle a Mad Scientist in Ancient China,2006-02-15,179,NC-17,2006,2.99,20.99,Trailers,Deleted Scenes,Behind the Scenes
721,REDS POCUS,A Lacklusture Yarn of a Sumo Wrestler And a Squirrel who must Redeem a Monkey in Soviet Georgia,2006-02-15,182,PG-13,2006,4.99,23.99,Trailers,Behind the Scenes
722,REEF SALUTE,A Action-Packed Saga of a Teacher And a Lumberjack who must Battle a Dentist in A Baloon,2006-02-15,123,NC-17,2006,0.99,26.99,Behind the Scenes
723,REIGN GENTLEMEN,A Emotional Yarn of a Composer And a Man who must Escape a Butler in The Gulf of Mexico,2006-02-15,82,PG-13,2006,2.99,29.99,Deleted Scenes,Behind the Scenes
724,REMEMBER DIARY,A Insightful Tale of a Technical Writer And a Waitress who must Conquer a Monkey in Ancient India,2006-02-15,110,R,2006,2.99,15.99,Trailers,Commentaries
725,REQUIEM TYCOON,A Unbelieveable Character Study of a Cat And a Database Administrator who must Pursue a Teacher in A Monastery,2006-02-15,167,R,2006,4.99,25.99,Trailers,Commentaries,Behind the Scenes
726,RESERVOIR ADAPTATION,A Intrepid Drama of a Teacher And a Moose who must Kill a Car in California,2006-02-15,61,PG-13,2006,2.99,29.99,Commentaries
727,RESURRECTION SILVERADO,A Epic Yarn of a Robot And a Explorer who must Challenge a Girl in A MySQL Convention,2006-02-15,117,PG,2006,0.99,12.99,Trailers,Deleted Scenes
728,REUNION WITCHES,A Unbelieveable Documentary of a Database Administrator And a Frisbee who must Redeem a Mad Scientist in A Baloon Factory,2006-02-15,63,R,2006,0.99,26.99,Commentaries
729,RIDER CADDYSHACK,A Taut Reflection of a Monkey And a Womanizer who must Chase a Moose in Nigeria,2006-02-15,177,PG,2006,2.99,28.99,Commentaries,Behind the Scenes
730,RIDGEMONT SUBMARINE,A Unbelieveable Drama of a Waitress And a Composer who must Sink a Mad Cow in Ancient Japan,2006-02-15,46,PG-13,2006,0.99,28.99,Commentaries,Deleted Scenes,Behind the Scenes
731,RIGHT CRANES,A Fateful Character Study of a Boat And a Cat who must Find a Database Administrator in A Jet Boat,2006-02-15,153,PG-13,2006,4.99,29.99,Trailers,Commentaries,Deleted Scenes
