392,HALL CASSIDY,A Beautiful Panorama of a Pastry Chef And a A Shark who must Battle a Pioneer in Soviet Georgia,2006-02-15,51,NC-17,2006,4.99,13.99,Commentaries,Behind the Scenes
393,HALLOWEEN NUTS,A Amazing Panorama of a Forensic Psychologist And a Technical Writer who must Fight a Dentist in A U-Boat,2006-02-15,47,PG-13,2006,2.99,19.99,Deleted Scenes
394,HAMLET WISDOM,A Touching Reflection of a Man And a Man who must Sink a Robot in The Outback,2006-02-15,146,R,2006,2.99,21.99,Trailers,Deleted Scenes
395,HANDICAP BOONDOCK,A Beautiful Display of a Pioneer And a Squirrel who must Vanquish a Sumo Wrestler in Soviet Georgia,2006-02-15,108,R,2006,0.99,28.99,Commentaries,Deleted Scenes,Behind the Scenes
396,HANGING DEEP,A Action-Packed Yarn of a Boat And a Crocodile who must Build a Monkey in Berlin,2006-02-15,62,G,2006,4.99,18.99,Trailers,Commentaries,Deleted Scenes
397,HANKY OCTOBER,A Boring Epistle of a Database Administrator And a Explorer who must Pursue a Madman in Soviet Georgia,2006-02-15,107,NC-17,2006,2.99,26.99,Trailers,Commentaries,Deleted Scenes
398,HANOVER GALAXY,A Stunning Reflection of a Girl And a Secret Agent who must Succumb a Boy in A MySQL Convention,2006-02-15,47,NC-17,2006,4.99,21.99,Commentaries,Deleted Scenes,Behind the Scenes
399,HAPPINESS UNITED,A Action-Packed Panorama of a Husband And a Feminist who must Meet a Forensic Psychologist in Ancient Japan,2006-02-15,100,G,2006,2.99,23.99,Deleted Scenes
400,HARDLY ROBBERS,A Emotional Character Study of a Hunter And a Car who must Kill a Woman in Berlin,2006-02-15,72,R,2006,2.99,15.99,Trailers,Behind the Scenes
1,ACADEMY DINOSAUR,A Epic Drama of a Feminist And a Mad Scientist who must Battle a Teacher in The Canadian Rockies,2006-02-15,86,PG,2006,0.99,20.99,Deleted Scenes,Behind the Scenes
5,AFRICAN EGG,A Fast-Paced Documentary of a Pastry Chef And a Dentist who must Pursue a Forensic Psychologist in The Gulf of Mexico,2006-02-15,130,G,2006,2.99,22.99,Deleted Scenes
9,ALABAMA DEVIL,A Thoughtful Panorama of a Database Administrator And a Mad Scientist who must Outgun a Mad Scientist in A Jet Boat,2006-02-15,114,PG-13,2006,2.99,21.99,Trailers,Deleted Scenes
13,ALI FOREVER,A Action-Packed Drama of a Dentist And a Crocodile who must Battle a Feminist in The Canadian Rockies,2006-02-15,150,PG,2006,4.99,21.99,Deleted Scenes,Behind the Scenes
18,ALTER VICTORY,A Thoughtful Drama of a Composer And a Feminist who must Meet a Secret Agent in The Canadian Rockies,2006-02-15,57,PG-13,2006,0.99,27.99,Trailers,Behind the Scenes
21,AMERICAN CIRCUS,A Insightful Drama of a Girl And a Astronaut who must Face a Database Administrator in A Shark Tank,2006-02-15,129,R,2006,4.99,17.99,Commentaries,Behind the Scenes
25,ANGELS LIFE,A Thoughtful Display of a Woman And a Astronaut who must Battle a Robot in Berlin,2006-02-15,74,G,2006,2.99,15.99,Trailers
29,ANTITRUST TOMATOES,A Fateful Yarn of a Womanizer And a Feminist who must Succumb a Database Administrator in Ancient India,2006-02-15,168,NC-17,2006,2.99,11.99,Trailers,Commentaries,Deleted Scenes
33,APOLLO TEEN,A Action-Packed Reflection of a Crocodile And a Explorer who must Find a Sumo Wrestler in An Abandoned Mine Shaft,2006-02-15,153,PG-13,2006,2.99,15.99,Trailers,Commentaries,Deleted Scenes,Behind the Scenes
37,ARIZONA BANG,A Brilliant Panorama of a Mad Scientist And a Mad Cow who must Meet a Pioneer in A Monastery,2006-02-15,121,PG,2006,2.99,28.99,Trailers,Deleted Scenes
40,ARMY FLINTSTONES,A Boring Saga of a Database Administrator And a Womanizer who must Battle a Waitress in Nigeria,2006-02-15,148,R,2006,0.99,22.99,Trailers,Commentaries
44,ATTACKS HATE,A Fast-Paced Panorama of a Technical Writer And a Mad Scientist who must Find a Feminist in An Abandoned Mine Shaft,2006-02-15,113,PG-13,2006,4.99,21.99,Trailers,Behind the Scenes
48,BACKLASH UNDEFEATED,A Stunning Character Study of a Mad Scientist And a Mad Cow who must Kill a Car in A Monastery,2006-02-15,118,PG-13,2006,4.99,24.99,Trailers,Behind the Scenes
51,BALLOON HOMEWARD,A Insightful Panorama of a Forensic Psychologist And a Mad Cow who must Build a Mad Scientist in The First Manned Space Station,2006-02-15,75,NC-17,2006,2.99,10.99,Deleted Scenes
54,BANGER PINOCCHIO,A Awe-Inspiring Drama of a Car And a Pastry Chef who must Chase a Crocodile in The First Manned Space Station,2006-02-15,113,R,2006,0.99,15.99,Trailers,Commentaries,Deleted Scenes
58,BEACH HEARTBREAKERS,A Fateful Display of a Womanizer And a Mad Scientist who must Outgun a A Shark in Soviet Georgia,2006-02-15,122,G,2006,2.99,16.99,Deleted Scenes,Behind the Scenes
62,BED HIGHBALL,A Astounding Panorama of a Lumberjack And a Dog who must Redeem a Woman in An Abandoned Fun House,2006-02-15,106,NC-17,2006,2.99,23.99,Trailers,Commentaries,Deleted Scenes
66,BENEATH RUSH,A Astounding Panorama of a Man And a Monkey who must Discover a Man in The First Manned Space Station,2006-02-15,53,NC-17,2006,0.99,27.99,Commentaries,Deleted Scenes
70,BIKINI BORROWERS,A Astounding Drama of a Astronaut And a Cat who must Discover a Woman in The First Manned Space Station,2006-02-15,142,NC-17,2006,4.99,26.99,Commentaries,Deleted Scenes
73,BINGO TALENTED,A Touching Tale of a Girl And a Crocodile who must Discover a Waitress in Nigeria,2006-02-15,150,PG-13,2006,2.99,22.99,Trailers,Commentaries
77,BIRDS PERDITION,A Boring Story of a Womanizer And a Pioneer who must Face a Dog in California,2006-02-15,61,G,2006,4.99,15.99,Trailers,Behind the Scenes
81,BLINDNESS GUN,A Touching Drama of a Robot And a Dentist who must Meet a Hunter in A Jet Boat,2006-02-15,103,PG-13,2006,4.99,29.99,Trailers,Behind the Scenes
84,BOILED DARES,A Awe-Inspiring Story of a Waitress And a Dog who must Discover a Dentist in Ancient Japan,2006-02-15,102,PG,2006,4.99,13.99,Trailers,Commentaries
88,BORN SPINAL,A Touching Epistle of a Frisbee And a Husband who must Pursue a Student in Nigeria,2006-02-15,179,PG,2006,4.99,17.99,Trailers,Commentaries,Deleted Scenes
92,BOWFINGER GABLES,A Fast-Paced Yarn of a Waitress And a Composer who must Outgun a Dentist in California,2006-02-15,72,NC-17,2006,4.99,19.99,Trailers,Deleted Scenes
96,BREAKING HOME,A Beautiful Display of a Secret Agent And a Monkey who must Battle a Sumo Wrestler in An Abandoned Mine Shaft,2006-02-15,169,PG-13,2006,2.99,21.99,Trailers,Commentaries
100,BROOKLYN DESERT,A Beautiful Drama of a Dentist And a Composer who must Battle a Sumo Wrestler in The First Manned Space Station,2006-02-15,161,R,2006,4.99,21.99,Commentaries
103,BUCKET BROTHERHOOD,A Amazing Display of a Girl And a Womanizer who must Succumb a Lumberjack in A Baloon Factory,2006-02-15,133,PG,2006,4.99,27.99,Commentaries,Deleted Scenes
107,BUNCH MINDS,A Emotional Story of a Feminist And a Feminist who must Escape a Pastry Chef in A MySQL Convention,2006-02-15,63,G,2006,2.99,13.99,Behind the Scenes
110,CABIN FLASH,A Stunning Epistle of a Boat And a Man who must Challenge a A Shark in A Baloon Factory,2006-02-15,53,NC-17,2006,0.99,25.99,Commentaries,Deleted Scenes
114,CAMELOT VACATION,A Touching Character Study of a Woman And a Waitress who must Battle a Pastry Chef in A MySQL Convention,2006-02-15,61,NC-17,2006,0.99,26.99,Trailers,Commentaries,Deleted Scenes,Behind the Scenes
116,CANDIDATE PERDITION,A Brilliant Epistle of a Composer And a Database Administrator who must Vanquish a Mad Scientist in The First Manned Space Station,2006-02-15,70,R,2006,2.99,10.99,Deleted Scenes,Behind the Scenes
121,CAROL TEXAS,A Astounding Character Study of a Composer And a Student who must Overcome a Composer in A Monastery,2006-02-15,151,PG,2006,2.99,15.99,Trailers,Behind the Scenes
125,CASSIDY WYOMING,A Intrepid Drama of a Frisbee And a Hunter who must Kill a Secret Agent in New Orleans,2006-02-15,61,NC-17,2006,2.99,19.99,Commentaries,Behind the Scenes
129,CAUSE DATE,A Taut Tale of a Explorer And a Pastry Chef who must Conquer a Hunter in A MySQL Convention,2006-02-15,179,R,2006,2.99,16.99,Commentaries,Deleted Scenes,Behind the Scenes
133,CHAMBER ITALIAN,A Fateful Reflection of a Moose And a Husband who must Overcome a Monkey in Nigeria,2006-02-15,117,NC-17,2006,4.99,14.99,Trailers
137,CHARADE DUFFEL,A Action-Packed Display of a Man And a Waitress who must Build a Dog in A MySQL Convention,2006-02-15,66,PG,2006,2.99,21.99,Trailers,Deleted Scenes,Behind the Scenes
141,CHICAGO NORTH,A Fateful Yarn of a Mad Cow And a Waitress who must Battle a Student in California,2006-02-15,185,PG-13,2006,4.99,11.99,Deleted Scenes,Behind the Scenes
144,CHINATOWN GLADIATOR,A Brilliant Panorama of a Technical Writer And a Lumberjack who must Escape a Butler in Ancient India,2006-02-15,61,PG,2006,4.99,24.99,Trailers,Commentaries,Deleted Scenes
148,CHOCOLATE DUCK,A Unbelieveable Story of a Mad Scientist And a Technical Writer who must Discover a Composer in Ancient China,2006-02-15,132,R,2006,2.99,13.99,Trailers,Commentaries,Behind the Scenes
152,CIRCUS YOUTH,A Thoughtful Drama of a Pastry Chef And a Dentist who must Pursue a Girl in A Baloon,2006-02-15,90,PG-13,2006,2.99,13.99,Trailers,Deleted Scenes,Behind the Scenes
156,CLERKS ANGELS,A Thrilling Display of a Sumo Wrestler And a Girl who must Confront a Man in A Baloon,2006-02-15,164,G,2006,4.99,15.99,Commentaries
160,CLUB GRAFFITI,A Epic Tale of a Pioneer And a Hunter who must Escape a Girl in A U-Boat,2006-02-15,65,PG-13,2006,0.99,12.99,Trailers,Deleted Scenes
164,COAST RAINBOW,A Astounding Documentary of a Mad Cow And a Pioneer who must Challenge a Butler in The Sahara Desert,2006-02-15,55,PG,2006,0.99,20.99,Trailers,Commentaries,Deleted Scenes,Behind the Scenes
168,COMANCHEROS ENEMY,A Boring Saga of a Lumberjack And a Monkey who must Find a Monkey in The Gulf of Mexico,2006-02-15,67,R,2006,0.99,23.99,Trailers,Behind the Scenes
173,CONFESSIONS MAGUIRE,A Insightful Story of a Car And a Boy who must Battle a Technical Writer in A Baloon,2006-02-15,65,PG-13,2006,4.99,25.99,Behind the Scenes
177,CONNECTICUT TRAMP,A Unbelieveable Drama of a Crocodile And a Mad Cow who must Reach a Dentist in A Shark Tank,2006-02-15,172,R,2006,4.99,20.99,Commentaries,Deleted Scenes
181,CONTACT ANONYMOUS,A Insightful Display of a A Shark And a Monkey who must Face a Database Administrator in Ancient India,2006-02-15,166,PG-13,2006,2.99,10.99,Commentaries
185,COWBOY DOOM,A Astounding Drama of a Boy And a Lumberjack who must Fight a Butler in A Baloon,2006-02-15,146,PG,2006,2.99,10.99,Commentaries,Deleted Scenes,Behind the Scenes
189,CREATURES SHAKESPEARE,A Emotional Drama of a Womanizer And a Squirrel who must Vanquish a Crocodile in Ancient India,2006-02-15,139,NC-17,2006,0.99,23.99,Trailers,Deleted Scenes
192,CROSSING DIVORCE,A Beautiful Documentary of a Dog And a Robot who must Redeem a Womanizer in Berlin,2006-02-15,50,R,2006,4.99,19.99,Commentaries,Deleted Scenes,Behind the Scenes
196,CRUELTY UNFORGIVEN,A Brilliant Tale of a Car And a Moose who must Battle a Dentist in Nigeria,2006-02-15,69,G,2006,0.99,29.99,Deleted Scenes,Behind the Scenes
200,CURTAIN VIDEOTAPE,A Boring Reflection of a Dentist And a Mad Cow who must Chase a Secret Agent in A Shark Tank,2006-02-15,133,PG-13,2006,0.99,27.99,Trailers,Commentaries,Deleted Scenes,Behind the Scenes
204,DALMATIONS SWEDEN,A Emotional Epistle of a Moose And a Hunter who must Overcome a Robot in A Manhattan Penthouse,2006-02-15,106,PG,2006,0.99,25.99,Trailers,Commentaries,Deleted Scenes
208,DARES PLUTO,A Fateful Story of a Robot And a Dentist who must Defeat a Astronaut in New Orleans,2006-02-15,89,PG-13,2006,2.99,16.99,Commentaries,Behind the Scenes
212,DARN FORRESTER,A Fateful Story of a A Shark And a Explorer who must Succumb a Technical Writer in A Jet Boat,2006-02-15,185,G,2006,4.99,14.99,Deleted Scenes
216,DAY UNFAITHFUL,A Stunning Documentary of a Composer And a Mad Scientist who must Find a Technical Writer in A U-Boat,2006-02-15,113,G,2006,4.99,16.99,Trailers,Commentaries,Deleted Scenes,Behind the Scenes
220,DEER VIRGINIAN,A Thoughtful Story of a Mad Cow And a Womanizer who must Overcome a Mad Scientist in Soviet Georgia,2006-02-15,106,NC-17,2006,2.99,13.99,Deleted Scenes
222,DESERT POSEIDON,A Brilliant Documentary of a Butler And a Frisbee who must Build a Astronaut in New Orleans,2006-02-15,64,R,2006,4.99,27.99,Trailers,Behind the Scenes
225,DESTINATION JERK,A Beautiful Yarn of a Teacher And a Cat who must Build a Car in A U-Boat,2006-02-15,76,PG-13,2006,0.99,19.99,Trailers,Commentaries,Behind the Scenes
229,DEVIL DESIRE,A Beautiful Reflection of a Monkey And a Dentist who must Face a Database Administrator in Ancient Japan,2006-02-15,87,R,2006,4.99,12.99,Trailers,Behind the Scenes
233,DISCIPLE MOTHER,A Touching Reflection of a Mad Scientist And a Boat who must Face a Moose in A Shark Tank,2006-02-15,141,PG,2006,0.99,17.99,Trailers,Deleted Scenes,Behind the Scenes
236,DIVINE RESURRECTION,A Boring Character Study of a Man And a Womanizer who must Succumb a Teacher in An Abandoned Amusement Park,2006-02-15,100,R,2006,2.99,19.99,Trailers,Commentaries
239,DOGMA FAMILY,A Brilliant Character Study of a Database Administrator And a Monkey who must Succumb a Astronaut in New Orleans,2006-02-15,122,G,2006,4.99,16.99,Commentaries
243,DOORS PRESIDENT,A Awe-Inspiring Display of a Squirrel And a Woman who must Overcome a Boy in The Gulf of Mexico,2006-02-15,49,NC-17,2006,4.99,22.99,Trailers,Commentaries,Deleted Scenes,Behind the Scenes
247,DOWNHILL ENOUGH,A Emotional Tale of a Pastry Chef And a Forensic Psychologist who must Succumb a Monkey in The Sahara Desert,2006-02-15,47,G,2006,0.99,19.99,Trailers,Commentaries,Deleted Scenes
251,DRAGONFLY STRANGERS,A Boring Documentary of a Pioneer And a Man who must Vanquish a Man in Nigeria,2006-02-15,133,NC-17,2006,4.99,19.99,Trailers,Behind the Scenes
254,DRIVER ANNIE,A Lacklusture Character Study of a Butler And a Car who must Redeem a Boat in An Abandoned Fun House,2006-02-15,159,PG-13,2006,2.99,11.99,Trailers,Deleted Scenes,Behind the Scenes
257,DRUMLINE CYCLONE,A Insightful Panorama of a Monkey And a Sumo Wrestler who must Outrace a Mad Scientist in The Canadian Rockies,2006-02-15,110,G,2006,0.99,14.99,Commentaries,Deleted Scenes,Behind the Scenes
262,DUMBO LUST,A Touching Display of a Feminist And a Dentist who must Conquer a Husband in The Gulf of Mexico,2006-02-15,119,NC-17,2006,0.99,17.99,Behind the Scenes
265,DYING MAKER,A Intrepid Tale of a Boat And a Monkey who must Kill a Cat in California,2006-02-15,168,PG,2006,4.99,28.99,Behind the Scenes
268,EARLY HOME,A Amazing Panorama of a Mad Scientist And a Husband who must Meet a Woman in The Outback,2006-02-15,96,NC-17,2006,4.99,27.99,Trailers,Commentaries,Behind the Scenes
272,EDGE KISSING,A Beautiful Yarn of a Composer And a Mad Cow who must Redeem a Mad Scientist in A Jet Boat,2006-02-15,153,NC-17,2006,4.99,9.99,Deleted Scenes
275,EGYPT TENENBAUMS,A Intrepid Story of a Madman And a Secret Agent who must Outrace a Astronaut in An Abandoned Amusement Park,2006-02-15,85,PG,2006,0.99,11.99,Commentaries,Deleted Scenes,Behind the Scenes
278,ELF MURDER,A Action-Packed Story of a Frisbee And a Woman who must Reach a Girl in An Abandoned Mine Shaft,2006-02-15,155,NC-17,2006,4.99,19.99,Trailers,Commentaries,Behind the Scenes
281,ENCINO ELF,A Astounding Drama of a Feminist And a Teacher who must Confront a Husband in A Baloon,2006-02-15,143,G,2006,0.99,9.99,Trailers,Behind the Scenes
284,ENEMY ODDS,A Fanciful Panorama of a Mad Scientist And a Woman who must Pursue a Astronaut in Ancient India,2006-02-15,77,NC-17,2006,4.99,23.99,Trailers
287,ENTRAPMENT SATISFACTION,A Thoughtful Panorama of a Hunter And a Teacher who must Reach a Mad Cow in A U-Boat,2006-02-15,176,R,2006,0.99,19.99,Commentaries,Deleted Scenes,Behind the Scenes
290,EVERYONE CRAFT,A Fateful Display of a Waitress And a Dentist who must Reach a Butler in Nigeria,2006-02-15,163,PG,2006,0.99,29.99,Trailers,Commentaries
293,EXORCIST STING,A Touching Drama of a Dog And a Sumo Wrestler who must Conquer a Mad Scientist in Berlin,2006-02-15,167,G,2006,2.99,17.99,Commentaries,Deleted Scenes,Behind the Scenes
297,EXTRAORDINARY CONQUERER,A Stunning Story of a Dog And a Feminist who must Face a Forensic Psychologist in Berlin,2006-02-15,122,G,2006,2.99,29.99,Trailers,Commentaries,Deleted Scenes
300,FALCON VOLUME,A Fateful Saga of a Sumo Wrestler And a Hunter who must Redeem a A Shark in New Orleans,2006-02-15,102,PG-13,2006,4.99,21.99,Commentaries,Behind the Scenes
303,FANTASY TROOPERS,A Touching Saga of a Teacher And a Monkey who must Overcome a Secret Agent in A MySQL Convention,2006-02-15,58,PG-13,2006,0.99,27.99,Behind the Scenes
306,FEATHERS METAL,A Thoughtful Yarn of a Monkey And a Teacher who must Find a Dog in Australia,2006-02-15,104,PG-13,2006,0.99,12.99,Trailers,Deleted Scenes
309,FEUD FROGMEN,A Brilliant Reflection of a Database Administrator And a Mad Cow who must Chase a Woman in The Canadian Rockies,2006-02-15,98,R,2006,0.99,29.99,Trailers,Commentaries,Deleted Scenes,Behind the Scenes
313,FIDELITY DEVIL,A Awe-Inspiring Drama of a Technical Writer And a Composer who must Reach a Pastry Chef in A U-Boat,2006-02-15,118,G,2006,4.99,11.99,Trailers,Deleted Scenes,Behind the Scenes
317,FIREBALL PHILADELPHIA,A Amazing Yarn of a Dentist And a A Shark who must Vanquish a Madman in An Abandoned Mine Shaft,2006-02-15,148,PG,2006,0.99,25.99,Trailers,Commentaries,Behind the Scenes
321,FLASH WARS,A Astounding Saga of a Moose And a Pastry Chef who must Chase a Student in The Gulf of Mexico,2006-02-15,123,NC-17,2006,4.99,21.99,Trailers,Commentaries,Behind the Scenes
325,FLOATS GARDEN,A Action-Packed Epistle of a Robot And a Car who must Chase a Boat in Ancient Japan,2006-02-15,145,PG-13,2006,2.99,29.99,Trailers,Commentaries,Behind the Scenes
329,FORREST SONS,A Thrilling Documentary of a Forensic Psychologist And a Butler who must Defeat a Explorer in A Jet Boat,2006-02-15,63,R,2006,2.99,15.99,Commentaries
333,FREAKY POCUS,A Fast-Paced Documentary of a Pastry Chef And a Crocodile who must Chase a Squirrel in The Gulf of Mexico,2006-02-15,126,R,2006,2.99,16.99,Trailers,Behind the Scenes
337,FRIDA SLIPPER,A Fateful Story of a Lumberjack And a Car who must Escape a Boat in An Abandoned Mine Shaft,2006-02-15,73,R,2006,2.99,11.99,Trailers,Deleted Scenes
340,FRONTIER CABIN,A Emotional Story of a Madman And a Waitress who must Battle a Teacher in An Abandoned Fun House,2006-02-15,183,PG-13,2006,4.99,14.99,Commentaries,Deleted Scenes
344,FURY MURDER,A Lacklusture Reflection of a Boat And a Forensic Psychologist who must Fight a Waitress in A Monastery,2006-02-15,178,PG-13,2006,0.99,28.99,Deleted Scenes
347,GAMES BOWFINGER,A Astounding Documentary of a Butler And a Explorer who must Challenge a Butler in A Monastery,2006-02-15,119,PG-13,2006,4.99,17.99,Behind the Scenes
351,GASLIGHT CRUSADE,A Amazing Epistle of a Boy And a Astronaut who must Redeem a Man in The Gulf of Mexico,2006-02-15,106,PG,2006,2.99,10.99,Trailers,Deleted Scenes
356,GIANT TROOPERS,A Fateful Display of a Feminist And a Monkey who must Vanquish a Monkey in The Canadian Rockies,2006-02-15,102,R,2006,2.99,10.99,Trailers,Commentaries
360,GLASS DYING,A Astounding Drama of a Frisbee And a Astronaut who must Fight a Dog in Ancient Japan,2006-02-15,103,G,2006,0.99,24.99,Trailers
364,GODFATHER DIARY,A Stunning Saga of a Lumberjack And a Squirrel who must Chase a Car in The Outback,2006-02-15,73,NC-17,2006,2.99,14.99,Trailers
369,GOODFELLAS SALUTE,A Unbelieveable Tale of a Dog And a Explorer who must Sink a Mad Cow in A Baloon Factory,2006-02-15,56,PG,2006,4.99,22.99,Deleted Scenes
401,HAROLD FRENCH,A Stunning Saga of a Sumo Wrestler And a Student who must Outrace a Moose in The Sahara Desert,2006-02-15,168,NC-17,2006,0.99,10.99,Commentaries,Deleted Scenes,Behind the Scenes
402,HARPER DYING,A Awe-Inspiring Reflection of a Woman And a Cat who must Confront a Feminist in The Sahara Desert,2006-02-15,52,G,2006,0.99,15.99,Trailers
403,HARRY IDAHO,A Taut Yarn of a Technical Writer And a Feminist who must Outrace a Dog in California,2006-02-15,121,PG-13,2006,4.99,18.99,Commentaries,Deleted Scenes
404,HATE HANDICAP,A Intrepid Reflection of a Mad Scientist And a Pioneer who must Overcome a Hunter in The First Manned Space Station,2006-02-15,107,PG,2006,0.99,26.99,Trailers,Commentaries,Behind the Scenes
405,HAUNTED ANTITRUST,A Amazing Saga of a Man And a Dentist who must Reach a Technical Writer in Ancient India,2006-02-15,76,NC-17,2006,4.99,13.99,Trailers,Deleted Scenes
406,HAUNTING PIANIST,A Fast-Paced Story of a Database Administrator And a Composer who must Defeat a Squirrel in An Abandoned Amusement Park,2006-02-15,181,R,2006,0.99,22.99,Behind the Scenes
407,HAWK CHILL,A Action-Packed Drama of a Mad Scientist And a Composer who must Outgun a Car in Australia,2006-02-15,47,PG-13,2006,0.99,12.99,Behind the Scenes
408,HEAD STRANGER,A Thoughtful Saga of a Hunter And a Crocodile who must Confront a Dog in The Gulf of Mexico,2006-02-15,69,R,2006,4.99,28.99,Trailers,Commentaries
409,HEARTBREAKERS BRIGHT,A Awe-Inspiring Documentary of a A Shark And a Dentist who must Outrace a Pastry Chef in The Canadian Rockies,2006-02-15,59,G,2006,4.99,9.99,Trailers,Deleted Scenes
410,HEAVEN FREEDOM,A Intrepid Story of a Butler And a Car who must Vanquish a Man in New Orleans,2006-02-15,48,PG,2006,2.99,19.99,Commentaries
411,HEAVENLY GUN,A Beautiful Yarn of a Forensic Psychologist And a Frisbee who must Battle a Moose in A Jet Boat,2006-02-15,49,NC-17,2006,4.99,13.99,Behind the Scenes
412,HEAVYWEIGHTS BEAST,A Unbelieveable Story of a Composer And a Dog who must Overcome a Womanizer in An Abandoned Amusement Park,2006-02-15,102,G,2006,4.99,25.99,Deleted Scenes
413,HEDWIG ALTER,A Action-Packed Yarn of a Womanizer And a Lumberjack who must Chase a Sumo Wrestler in A Monastery,2006-02-15,169,NC-17,2006,2.99,16.99,Trailers,Commentaries,Behind the Scenes
414,HELLFIGHTERS SIERRA,A Taut Reflection of a A Shark And a Dentist who must Battle a Boat in Soviet Georgia,2006-02-15,75,PG,2006,2.99,23.99,Deleted Scenes,Behind the Scenes
415,HIGH ENCINO,A Fateful Saga of a Waitress And a Hunter who must Outrace a Sumo Wrestler in Australia,2006-02-15,84,R,2006,2.99,23.99,Trailers,Commentaries,Behind the Scenes
416,HIGHBALL POTTER,A Action-Packed Saga of a Husband And a Dog who must Redeem a Database Administrator in The Sahara Desert,2006-02-15,110,R,2006,0.99,10.99,Deleted Scenes
417,HILLS NEIGHBORS,A Epic Display of a Hunter And a Feminist who must Sink a Car in A U-Boat,2006-02-15,93,G,2006,0.99,29.99,Trailers,Commentaries,Deleted Scenes,Behind the Scenes
418,HOBBIT ALIEN,A Emotional Drama of a Husband And a Girl who must Outgun a Composer in The First Manned Space Station,2006-02-15,157,PG-13,2006,0.99,27.99,Commentaries
419,HOCUS FRIDA,A Awe-Inspiring Tale of a Girl And a Madman who must Outgun a Student in A Shark Tank,2006-02-15,141,G,2006,2.99,19.99,Trailers,Deleted Scenes,Behind the Scenes
420,HOLES BRANNIGAN,A Fast-Paced Reflection of a Technical Writer And a Student who must Fight a Boy in The Canadian Rockies,2006-02-15,128,PG,2006,4.99,27.99,Commentaries,Behind the Scenes
421,HOLIDAY GAMES,A Insightful Reflection of a Waitress And a Madman who must Pursue a Boy in Ancient Japan,2006-02-15,78,PG-13,2006,4.99,10.99,Trailers,Commentaries,Behind the Scenes
422,HOLLOW JEOPARDY,A Beautiful Character Study of a Robot And a Astronaut who must Overcome a Boat in A Monastery,2006-02-15,136,NC-17,2006,4.99,25.99,Behind the Scenes
423,HOLLYWOOD ANONYMOUS,A Fast-Paced Epistle of a Boy And a Explorer who must Escape a Dog in A U-Boat,2006-02-15,69,PG,2006,0.99,29.99,Trailers,Behind the Scenes
424,HOLOCAUST HIGHBALL,A Awe-Inspiring Yarn of a Composer And a Man who must Find a Robot in Soviet Georgia,2006-02-15,149,R,2006,0.99,12.99,Deleted Scenes
425,HOLY TADPOLE,A Action-Packed Display of a Feminist And a Pioneer who must Pursue a Dog in A Baloon Factory,2006-02-15,88,R,2006,0.99,20.99,Behind the Scenes
426,HOME PITY,A Touching Panorama of a Man And a Secret Agent who must Challenge a Teacher in A MySQL Convention,2006-02-15,185,R,2006,4.99,15.99,Trailers,Commentaries,Behind the Scenes
427,HOMEWARD CIDER,A Taut Reflection of a Astronaut And a Squirrel who must Fight a Squirrel in A Manhattan Penthouse,2006-02-15,103,R,2006,0.99,19.99,Trailers
428,HOMICIDE PEACH,A Astounding Documentary of a Hunter And a Boy who must Confront a Boy in A MySQL Convention,2006-02-15,141,PG-13,2006,2.99,21.99,Commentaries
429,HONEY TIES,A Taut Story of a Waitress And a Crocodile who must Outrace a Lumberjack in A Shark Tank,2006-02-15,84,R,2006,0.99,29.99,Trailers,Commentaries,Deleted Scenes
430,HOOK CHARIOTS,A Insightful Story of a Boy And a Dog who must Redeem a Boy in Australia,2006-02-15,49,G,2006,0.99,23.99,Trailers,Commentaries,Behind the Scenes
431,HOOSIERS BIRDCAGE,A Astounding Display of a Explorer And a Boat who must Vanquish a Car in The First Manned Space Station,2006-02-15,176,G,2006,2.99,12.99,Trailers,Commentaries,Deleted Scenes
432,HOPE TOOTSIE,A Amazing Documentary of a Student And a Sumo Wrestler who must Outgun a A Shark in A Shark Tank,2006-02-15,139,NC-17,2006,2.99,22.99,Trailers,Deleted Scenes,Behind the Scenes
433,HORN WORKING,A Stunning Display of a Mad Scientist And a Technical Writer who must Succumb a Monkey in A Shark Tank,2006-02-15,95,PG,2006,2.99,23.99,Trailers
434,HORROR REIGN,A Touching Documentary of a A Shark And a Car who must Build a Husband in Nigeria,2006-02-15,139,R,2006,0.99,25.99,Deleted Scenes,Behind the Scenes
435,HOTEL HAPPINESS,A Thrilling Yarn of a Pastry Chef And a A Shark who must Challenge a Mad Scientist in The Outback,2006-02-15,181,PG-13,2006,4.99,28.99,Behind the Scenes
436,HOURS RAGE,A Fateful Story of a Explorer And a Feminist who must Meet a Technical Writer in Soviet Georgia,2006-02-15,122,NC-17,2006,0.99,14.99,Trailers,Deleted Scenes
437,HOUSE DYNAMITE,A Taut Story of a Pioneer And a Squirrel who must Battle a Student in Soviet Georgia,2006-02-15,109,R,2006,2.99,13.99,Commentaries,Deleted Scenes,Behind the Scenes
