438,HUMAN GRAFFITI,A Beautiful Reflection of a Womanizer And a Sumo Wrestler who must Chase a Database Administrator in The Gulf of Mexico,2006-02-15,68,NC-17,2006,2.99,22.99,Trailers,Behind the Scenes
439,HUNCHBACK IMPOSSIBLE,A Touching Yarn of a Frisbee And a Dentist who must Fight a Composer in Ancient Japan,2006-02-15,151,PG-13,2006,4.99,28.99,Trailers,Deleted Scenes
440,HUNGER ROOF,A Unbelieveable Yarn of a Student And a Database Administrator who must Outgun a Husband in An Abandoned Mine Shaft,2006-02-15,105,G,2006,0.99,21.99,Deleted Scenes,Behind the Scenes
441,HUNTER ALTER,A Emotional Drama of a Mad Cow And a Boat who must Redeem a Secret Agent in A Shark Tank,2006-02-15,125,PG-13,2006,2.99,21.99,Commentaries,Deleted Scenes,Behind the Scenes
442,HUNTING MUSKETEERS,A Thrilling Reflection of a Pioneer And a Dentist who must Outrace a Womanizer in An Abandoned Mine Shaft,2006-02-15,65,NC-17,2006,2.99,24.99,Trailers,Deleted Scenes
443,HURRICANE AFFAIR,A Lacklusture Epistle of a Database Administrator And a Woman who must Meet a Hunter in An Abandoned Mine Shaft,2006-02-15,49,PG,2006,2.99,11.99,Trailers,Commentaries,Behind the Scenes
444,HUSTLER PARTY,A Emotional Reflection of a Sumo Wrestler And a Monkey who must Conquer a Robot in The Sahara Desert,2006-02-15,83,NC-17,2006,4.99,22.99,Trailers,Commentaries,Behind the Scenes
445,HYDE DOCTOR,A Fanciful Documentary of a Boy And a Woman who must Redeem a Womanizer in A Jet Boat,2006-02-15,100,G,2006,2.99,11.99,Trailers,Deleted Scenes
446,HYSTERICAL GRAIL,A Amazing Saga of a Madman And a Dentist who must Build a Car in A Manhattan Penthouse,2006-02-15,150,PG,2006,4.99,19.99,Trailers,Commentaries,Deleted Scenes
447,ICE CROSSING,A Fast-Paced Tale of a Butler And a Moose who must Overcome a Pioneer in A Manhattan Penthouse,2006-02-15,131,R,2006,2.99,28.99,Deleted Scenes
448,IDAHO LOVE,A Fast-Paced Drama of a Student And a Crocodile who must Meet a Database Administrator in The Outback,2006-02-15,172,PG-13,2006,2.99,25.99,Trailers,Commentaries,Deleted Scenes,Behind the Scenes
449,IDENTITY LOVER,A Boring Tale of a Composer And a Mad Cow who must Defeat a Car in The Outback,2006-02-15,119,PG-13,2006,2.99,12.99,Deleted Scenes
450,IDOLS SNATCHERS,A Insightful Drama of a Car And a Composer who must Fight a Man in A Monastery,2006-02-15,84,NC-17,2006,2.99,29.99,Trailers
451,IGBY MAKER,A Epic Documentary of a Hunter And a Dog who must Outgun a Dog in A Baloon Factory,2006-02-15,160,NC-17,2006,4.99,12.99,Trailers,Behind the Scenes
452,ILLUSION AMELIE,A Emotional Epistle of a Boat And a Mad Scientist who must Outrace a Robot in An Abandoned Mine Shaft,2006-02-15,122,R,2006,0.99,15.99,Commentaries,Behind the Scenes
453,IMAGE PRINCESS,A Lacklusture Panorama of a Secret Agent And a Crocodile who must Discover a Madman in The Canadian Rockies,2006-02-15,178,PG-13,2006,2.99,17.99,Trailers,Commentaries,Deleted Scenes
454,IMPACT ALADDIN,A Epic Character Study of a Frisbee And a Moose who must Outgun a Technical Writer in A Shark Tank,2006-02-15,180,PG-13,2006,0.99,20.99,Trailers,Deleted Scenes
455,IMPOSSIBLE PREJUDICE,A Awe-Inspiring Yarn of a Monkey And a Hunter who must Chase a Teacher in Ancient China,2006-02-15,103,NC-17,2006,4.99,11.99,Deleted Scenes
456,INCH JET,A Fateful Saga of a Womanizer And a Student who must Defeat a Butler in A Monastery,2006-02-15,167,NC-17,2006,4.99,18.99,Deleted Scenes
457,INDEPENDENCE HOTEL,A Thrilling Tale of a Technical Writer And a Boy who must Face a Pioneer in A Monastery,2006-02-15,157,NC-17,2006,0.99,21.99,Trailers,Behind the Scenes
458,INDIAN LOVE,A Insightful Saga of a Mad Scientist And a Mad Scientist who must Kill a Astronaut in An Abandoned Fun House,2006-02-15,135,NC-17,2006,0.99,26.99,Trailers,Commentaries,Deleted Scenes,Behind the Scenes
459,INFORMER DOUBLE,A Action-Packed Display of a Woman And a Dentist who must Redeem a Forensic Psychologist in The Canadian Rockies,2006-02-15,74,NC-17,2006,4.99,23.99,Trailers,Commentaries
460,INNOCENT USUAL,A Beautiful Drama of a Pioneer And a Crocodile who must Challenge a Student in The Outback,2006-02-15,178,PG-13,2006,4.99,26.99,Trailers,Deleted Scenes,Behind the Scenes
461,INSECTS STONE,A Epic Display of a Butler And a Dog who must Vanquish a Crocodile in A Manhattan Penthouse,2006-02-15,123,NC-17,2006,0.99,14.99,Trailers,Commentaries,Behind the Scenes
462,INSIDER ARIZONA,A Astounding Saga of a Mad Scientist And a Hunter who must Pursue a Robot in A Baloon Factory,2006-02-15,78,NC-17,2006,2.99,17.99,Commentaries
463,INSTINCT AIRPORT,A Touching Documentary of a Mad Cow And a Explorer who must Confront a Butler in A Manhattan Penthouse,2006-02-15,116,PG,2006,2.99,21.99,Commentaries,Deleted Scenes
464,INTENTIONS EMPIRE,A Astounding Epistle of a Cat And a Cat who must Conquer a Mad Cow in A U-Boat,2006-02-15,107,PG-13,2006,2.99,13.99,Trailers,Behind the Scenes
465,INTERVIEW LIAISONS,A Action-Packed Reflection of a Student And a Butler who must Discover a Database Administrator in A Manhattan Penthouse,2006-02-15,59,R,2006,4.99,17.99,Commentaries,Behind the Scenes
466,INTOLERABLE INTENTIONS,A Awe-Inspiring Story of a Monkey And a Pastry Chef who must Succumb a Womanizer in A MySQL Convention,2006-02-15,63,PG-13,2006,4.99,20.99,Commentaries,Behind the Scenes
467,INTRIGUE WORST,A Fanciful Character Study of a Explorer And a Mad Scientist who must Vanquish a Squirrel in A Jet Boat,2006-02-15,181,G,2006,0.99,10.99,Deleted Scenes
468,INVASION CYCLONE,A Lacklusture Character Study of a Mad Scientist And a Womanizer who must Outrace a Explorer in A Monastery,2006-02-15,97,PG,2006,2.99,12.99,Trailers,Deleted Scenes
469,IRON MOON,A Fast-Paced Documentary of a Mad Cow And a Boy who must Pursue a Dentist in A Baloon,2006-02-15,46,PG,2006,4.99,27.99,Commentaries,Behind the Scenes
470,ISHTAR ROCKETEER,A Astounding Saga of a Dog And a Squirrel who must Conquer a Dog in An Abandoned Fun House,2006-02-15,79,R,2006,4.99,24.99,Trailers,Commentaries,Deleted Scenes
471,ISLAND EXORCIST,A Fanciful Panorama of a Technical Writer And a Boy who must Find a Dentist in An Abandoned Fun House,2006-02-15,84,NC-17,2006,2.99,23.99,Trailers,Commentaries
472,ITALIAN AFRICAN,A Astounding Character Study of a Monkey And a Moose who must Outgun a Cat in A U-Boat,2006-02-15,174,G,2006,4.99,24.99,Trailers,Commentaries,Deleted Scenes
473,JACKET FRISCO,A Insightful Reflection of a Womanizer And a Husband who must Conquer a Pastry Chef in A Baloon,2006-02-15,181,PG-13,2006,2.99,16.99,Trailers,Deleted Scenes,Behind the Scenes
474,JADE BUNCH,A Insightful Panorama of a Squirrel And a Mad Cow who must Confront a Student in The First Manned Space Station,2006-02-15,174,NC-17,2006,2.99,21.99,Trailers,Commentaries,Behind the Scenes
475,JAPANESE RUN,A Awe-Inspiring Epistle of a Feminist And a Girl who must Sink a Girl in The Outback,2006-02-15,135,G,2006,0.99,29.99,Deleted Scenes
476,JASON TRAP,A Thoughtful Tale of a Woman And a A Shark who must Conquer a Dog in A Monastery,2006-02-15,130,NC-17,2006,2.99,9.99,Trailers,Deleted Scenes,Behind the Scenes
477,JAWBREAKER BROOKLYN,A Stunning Reflection of a Boat And a Pastry Chef who must Succumb a A Shark in A Jet Boat,2006-02-15,118,PG,2006,0.99,15.99,Trailers,Behind the Scenes
478,JAWS HARRY,A Thrilling Display of a Database Administrator And a Monkey who must Overcome a Dog in An Abandoned Fun House,2006-02-15,112,G,2006,2.99,10.99,Deleted Scenes
479,JEDI BENEATH,A Astounding Reflection of a Explorer And a Dentist who must Pursue a Student in Nigeria,2006-02-15,128,PG,2006,0.99,12.99,Trailers,Commentaries,Deleted Scenes
480,JEEPERS WEDDING,A Astounding Display of a Composer And a Dog who must Kill a Pastry Chef in Soviet Georgia,2006-02-15,84,R,2006,2.99,29.99,Trailers,Commentaries,Deleted Scenes
481,JEKYLL FROGMEN,A Fanciful Epistle of a Student And a Astronaut who must Kill a Waitress in A Shark Tank,2006-02-15,58,PG,2006,2.99,22.99,Commentaries,Deleted Scenes,Behind the Scenes
482,JEOPARDY ENCINO,A Boring Panorama of a Man And a Mad Cow who must Face a Explorer in Ancient India,2006-02-15,102,R,2006,0.99,12.99,Trailers,Commentaries
483,JERICHO MULAN,A Amazing Yarn of a Hunter And a Butler who must Defeat a Boy in A Jet Boat,2006-02-15,171,NC-17,2006,2.99,29.99,Commentaries
484,JERK PAYCHECK,A Touching Character Study of a Pastry Chef And a Database Administrator who must Reach a A Shark in Ancient Japan,2006-02-15,172,NC-17,2006,2.99,13.99,Trailers,Commentaries,Deleted Scenes,Behind the Scenes
485,JERSEY SASSY,A Lacklusture Documentary of a Madman And a Mad Cow who must Find a Feminist in Ancient Japan,2006-02-15,60,PG,2006,4.99,16.99,Deleted Scenes,Behind the Scenes
486,JET NEIGHBORS,A Amazing Display of a Lumberjack And a Teacher who must Outrace a Woman in A U-Boat,2006-02-15,59,R,2006,4.99,14.99,Trailers,Commentaries,Behind the Scenes
487,JINGLE SAGEBRUSH,A Epic Character Study of a Feminist And a Student who must Meet a Woman in A Baloon,2006-02-15,124,PG-13,2006,4.99,29.99,Trailers,Commentaries
488,JOON NORTHWEST,A Thrilling Panorama of a Technical Writer And a Car who must Discover a Forensic Psychologist in A Shark Tank,2006-02-15,105,NC-17,2006,0.99,23.99,Trailers,Commentaries,Behind the Scenes
489,JUGGLER HARDLY,A Epic Story of a Mad Cow And a Astronaut who must Challenge a Car in California,2006-02-15,54,PG-13,2006,0.99,14.99,Trailers,Commentaries
490,JUMANJI BLADE,A Intrepid Yarn of a Husband And a Womanizer who must Pursue a Mad Scientist in New Orleans,2006-02-15,121,G,2006,2.99,13.99,Commentaries,Behind the Scenes
491,JUMPING WRATH,A Touching Epistle of a Monkey And a Feminist who must Discover a Boat in Berlin,2006-02-15,74,NC-17,2006,0.99,18.99,Commentaries,Behind the Scenes
492,JUNGLE CLOSER,A Boring Character Study of a Boy And a Woman who must Battle a Astronaut in Australia,2006-02-15,134,NC-17,2006,0.99,11.99,Trailers,Commentaries,Deleted Scenes
493,KANE EXORCIST,A Epic Documentary of a Composer And a Robot who must Overcome a Car in Berlin,2006-02-15,92,R,2006,0.99,18.99,Trailers,Commentaries
494,KARATE MOON,A Astounding Yarn of a Womanizer And a Dog who must Reach a Waitress in A MySQL Convention,2006-02-15,120,PG-13,2006,0.99,21.99,Behind the Scenes
495,KENTUCKIAN GIANT,A Stunning Yarn of a Woman And a Frisbee who must Escape a Waitress in A U-Boat,2006-02-15,169,PG,2006,2.99,10.99,Trailers,Commentaries,Deleted Scenes,Behind the Scenes
496,KICK SAVANNAH,A Emotional Drama of a Monkey And a Robot who must Defeat a Monkey in New Orleans,2006-02-15,179,PG-13,2006,0.99,10.99,Trailers,Commentaries,Deleted Scenes
497,KILL BROTHERHOOD,A Touching Display of a Hunter And a Secret Agent who must Redeem a Husband in The Outback,2006-02-15,54,G,2006,0.99,15.99,Trailers,Commentaries
498,KILLER INNOCENT,A Fanciful Character Study of a Student And a Explorer who must Succumb a Composer in An Abandoned Mine Shaft,2006-02-15,161,R,2006,2.99,11.99,Trailers,Commentaries,Deleted Scenes
499,KING EVOLUTION,A Action-Packed Tale of a Boy And a Lumberjack who must Chase a Madman in A Baloon,2006-02-15,184,NC-17,2006,4.99,24.99,Trailers,Deleted Scenes,Behind the Scenes
500,KISS GLORY,A Lacklusture Reflection of a Girl And a Husband who must Find a Robot in The Canadian Rockies,2006-02-15,163,PG-13,2006,4.99,11.99,Trailers,Commentaries,Behind the Scenes
501,KISSING DOLLS,A Insightful Reflection of a Pioneer And a Teacher who must Build a Composer in The First Manned Space Station,2006-02-15,141,R,2006,4.99,9.99,Trailers
502,KNOCK WARLOCK,A Unbelieveable Story of a Teacher And a Boat who must Confront a Moose in A Baloon,2006-02-15,71,PG-13,2006,2.99,21.99,Trailers
503,KRAMER CHOCOLATE,A Amazing Yarn of a Robot And a Pastry Chef who must Redeem a Mad Scientist in The Outback,2006-02-15,171,R,2006,2.99,24.99,Trailers
504,KWAI HOMEWARD,A Amazing Drama of a Car And a Squirrel who must Pursue a Car in Soviet Georgia,2006-02-15,46,PG-13,2006,0.99,25.99,Trailers,Commentaries
505,LABYRINTH LEAGUE,A Awe-Inspiring Saga of a Composer And a Frisbee who must Succumb a Pioneer in The Sahara Desert,2006-02-15,46,PG-13,2006,2.99,24.99,Commentaries,Behind the Scenes
506,LADY STAGE,A Beautiful Character Study of a Woman And a Man who must Pursue a Explorer in A U-Boat,2006-02-15,67,PG,2006,4.99,14.99,Trailers,Deleted Scenes,Behind the Scenes
507,LADYBUGS ARMAGEDDON,A Fateful Reflection of a Dog And a Mad Scientist who must Meet a Mad Scientist in New Orleans,2006-02-15,113,NC-17,2006,0.99,13.99,Deleted Scenes
508,LAMBS CINCINATTI,A Insightful Story of a Man And a Feminist who must Fight a Composer in Australia,2006-02-15,144,PG-13,2006,4.99,18.99,Trailers,Behind the Scenes
509,LANGUAGE COWBOY,A Epic Yarn of a Cat And a Madman who must Vanquish a Dentist in An Abandoned Amusement Park,2006-02-15,78,NC-17,2006,0.99,26.99,Trailers,Deleted Scenes
510,LAWLESS VISION,A Insightful Yarn of a Boy And a Sumo Wrestler who must Outgun a Car in The Outback,2006-02-15,181,G,2006,4.99,29.99,Deleted Scenes,Behind the Scenes
511,LAWRENCE LOVE,A Fanciful Yarn of a Database Administrator And a Mad Cow who must Pursue a Womanizer in Berlin,2006-02-15,175,NC-17,2006,0.99,23.99,Commentaries,Deleted Scenes,Behind the Scenes
512,LEAGUE HELLFIGHTERS,A Thoughtful Saga of a A Shark And a Monkey who must Outgun a Student in Ancient China,2006-02-15,110,PG-13,2006,4.99,25.99,Trailers
513,LEATHERNECKS DWARFS,A Fateful Reflection of a Dog And a Mad Cow who must Outrace a Teacher in An Abandoned Mine Shaft,2006-02-15,153,PG-13,2006,2.99,21.99,Trailers,Commentaries,Behind the Scenes
514,LEBOWSKI SOLDIERS,A Beautiful Epistle of a Secret Agent And a Pioneer who must Chase a Astronaut in Ancient China,2006-02-15,69,PG-13,2006,2.99,17.99,Commentaries,Deleted Scenes
515,LEGALLY SECRETARY,A Astounding Tale of a A Shark And a Moose who must Meet a Womanizer in The Sahara Desert,2006-02-15,113,PG,2006,4.99,14.99,Trailers,Commentaries,Behind the Scenes
516,LEGEND JEDI,A Awe-Inspiring Epistle of a Pioneer And a Student who must Outgun a Crocodile in The Outback,2006-02-15,59,PG,2006,0.99,18.99,Commentaries,Deleted Scenes
517,LESSON CLEOPATRA,A Emotional Display of a Man And a Explorer who must Build a Boy in A Manhattan Penthouse,2006-02-15,167,NC-17,2006,0.99,28.99,Deleted Scenes,Behind the Scenes
518,LIAISONS SWEET,A Boring Drama of a A Shark And a Explorer who must Redeem a Waitress in The Canadian Rockies,2006-02-15,140,PG,2006,4.99,15.99,Commentaries,Behind the Scenes
519,LIBERTY MAGNIFICENT,A Boring Drama of a Student And a Cat who must Sink a Technical Writer in A Baloon,2006-02-15,138,G,2006,2.99,27.99,Commentaries,Deleted Scenes,Behind the Scenes
520,LICENSE WEEKEND,A Insightful Story of a Man And a Husband who must Overcome a Madman in A Monastery,2006-02-15,91,NC-17,2006,2.99,28.99,Deleted Scenes,Behind the Scenes
521,LIES TREATMENT,A Fast-Paced Character Study of a Dentist And a Moose who must Defeat a Composer in The First Manned Space Station,2006-02-15,147,NC-17,2006,4.99,28.99,Commentaries,Deleted Scenes,Behind the Scenes
522,LIFE TWISTED,A Thrilling Reflection of a Teacher And a Composer who must Find a Man in The First Manned Space Station,2006-02-15,137,NC-17,2006,2.99,9.99,Commentaries,Deleted Scenes
523,LIGHTS DEER,A Unbelieveable Epistle of a Dog And a Woman who must Confront a Moose in The Gulf of Mexico,2006-02-15,174,R,2006,0.99,21.99,Commentaries
524,LION UNCUT,A Intrepid Display of a Pastry Chef And a Cat who must Kill a A Shark in Ancient China,2006-02-15,50,PG,2006,0.99,13.99,Trailers,Deleted Scenes
525,LOATHING LEGALLY,A Boring Epistle of a Pioneer And a Mad Scientist who must Escape a Frisbee in The Gulf of Mexico,2006-02-15,140,R,2006,0.99,29.99,Deleted Scenes
526,LOCK REAR,A Thoughtful Character Study of a Squirrel And a Technical Writer who must Outrace a Student in Ancient Japan,2006-02-15,120,R,2006,2.99,10.99,Trailers,Commentaries
527,LOLA AGENT,A Astounding Tale of a Mad Scientist And a Husband who must Redeem a Database Administrator in Ancient Japan,2006-02-15,85,PG,2006,4.99,24.99,Trailers,Commentaries
528,LOLITA WORLD,A Thrilling Drama of a Girl And a Robot who must Redeem a Waitress in An Abandoned Mine Shaft,2006-02-15,155,NC-17,2006,2.99,25.99,Trailers,Deleted Scenes
529,LONELY ELEPHANT,A Intrepid Story of a Student And a Dog who must Challenge a Explorer in Soviet Georgia,2006-02-15,67,G,2006,2.99,12.99,Trailers,Commentaries,Deleted Scenes,Behind the Scenes
530,LORD ARIZONA,A Action-Packed Display of a Frisbee And a Pastry Chef who must Pursue a Crocodile in A Jet Boat,2006-02-15,108,PG-13,2006,2.99,27.99,Trailers
531,LOSE INCH,A Stunning Reflection of a Student And a Technical Writer who must Battle a Butler in The First Manned Space Station,2006-02-15,137,R,2006,0.99,18.99,Trailers,Commentaries
532,LOSER HUSTLER,A Stunning Drama of a Robot And a Feminist who must Outgun a Butler in Nigeria,2006-02-15,80,PG,2006,4.99,28.99,Deleted Scenes,Behind the Scenes
533,LOST BIRD,A Emotional Character Study of a Robot And a A Shark who must Defeat a Technical Writer in A Manhattan Penthouse,2006-02-15,98,PG-13,2006,2.99,21.99,Deleted Scenes
534,LOUISIANA HARRY,A Lacklusture Drama of a Girl And a Technical Writer who must Redeem a Monkey in A Shark Tank,2006-02-15,70,PG-13,2006,0.99,18.99,Trailers
535,LOVE SUICIDES,A Brilliant Panorama of a Hunter And a Explorer who must Pursue a Dentist in An Abandoned Fun House,2006-02-15,181,R,2006,0.99,21.99,Trailers,Behind the Scenes
536,LOVELY JINGLE,A Fanciful Yarn of a Crocodile And a Forensic Psychologist who must Discover a Crocodile in The Outback,2006-02-15,65,PG,2006,2.99,18.99,Trailers,Behind the Scenes
537,LOVER TRUMAN,A Emotional Yarn of a Robot And a Boy who must Outgun a Technical Writer in A U-Boat,2006-02-15,75,G,2006,2.99,29.99,Trailers
538,LOVERBOY ATTACKS,A Boring Story of a Car And a Butler who must Build a Girl in Soviet Georgia,2006-02-15,162,PG-13,2006,0.99,19.99,Trailers,Behind the Scenes
539,LUCK OPUS,A Boring Display of a Moose And a Squirrel who must Outrace a Teacher in A Shark Tank,2006-02-15,152,NC-17,2006,2.99,21.99,Trailers,Commentaries,Behind the Scenes
540,LUCKY FLYING,A Lacklusture Character Study of a A Shark And a Man who must Find a Forensic Psychologist in A U-Boat,2006-02-15,97,PG-13,2006,2.99,10.99,Trailers,Commentaries,Behind the Scenes
541,LUKE MUMMY,A Taut Character Study of a Boy And a Robot who must Redeem a Mad Scientist in Ancient India,2006-02-15,74,NC-17,2006,2.99,21.99,Trailers,Behind the Scenes
542,LUST LOCK,A Fanciful Panorama of a Hunter And a Dentist who must Meet a Secret Agent in The Sahara Desert,2006-02-15,52,G,2006,2.99,28.99,Trailers,Commentaries,Behind the Scenes
543,MADIGAN DORADO,A Astounding Character Study of a A Shark And a A Shark who must Discover a Crocodile in The Outback,2006-02-15,116,R,2006,4.99,20.99,Deleted Scenes,Behind the Scenes
544,MADISON TRAP,A Awe-Inspiring Reflection of a Monkey And a Dentist who must Overcome a Pioneer in A U-Boat,2006-02-15,147,R,2006,2.99,11.99,Commentaries,Deleted Scenes,Behind the Scenes
545,MADNESS ATTACKS,A Fanciful Tale of a Squirrel And a Boat who must Defeat a Crocodile in The Gulf of Mexico,2006-02-15,178,PG-13,2006,0.99,14.99,Trailers
546,MADRE GABLES,A Intrepid Panorama of a Sumo Wrestler And a Forensic Psychologist who must Discover a Moose in The First Manned Space Station,2006-02-15,98,PG-13,2006,2.99,27.99,Trailers,Commentaries,Deleted Scenes
547,MAGIC MALLRATS,A Touching Documentary of a Pastry Chef And a Pastry Chef who must Build a Mad Scientist in California,2006-02-15,117,PG,2006,0.99,19.99,Trailers,Commentaries
548,MAGNIFICENT CHITTY,A Insightful Story of a Teacher And a Hunter who must Face a Mad Cow in California,2006-02-15,53,R,2006,2.99,27.99,Commentaries,Deleted Scenes
549,MAGNOLIA FORRESTER,A Thoughtful Documentary of a Composer And a Explorer who must Conquer a Dentist in New Orleans,2006-02-15,171,PG-13,2006,0.99,28.99,Trailers,Commentaries,Deleted Scenes
550,MAGUIRE APACHE,A Fast-Paced Reflection of a Waitress And a Hunter who must Defeat a Forensic Psychologist in A Baloon,2006-02-15,74,NC-17,2006,2.99,22.99,Trailers,Commentaries
551,MAIDEN HOME,A Lacklusture Saga of a Moose And a Teacher who must Kill a Forensic Psychologist in A MySQL Convention,2006-02-15,138,PG,2006,4.99,9.99,Behind the Scenes
552,MAJESTIC FLOATS,A Thrilling Character Study of a Moose And a Student who must Escape a Butler in The First Manned Space Station,2006-02-15,130,PG,2006,0.99,15.99,Trailers
553,MAKER GABLES,A Stunning Display of a Moose And a Database Administrator who must Pursue a Composer in A Jet Boat,2006-02-15,136,PG-13,2006,0.99,12.99,Deleted Scenes,Behind the Scenes
554,MALKOVICH PET,A Intrepid Reflection of a Waitress And a A Shark who must Kill a Squirrel in The Outback,2006-02-15,159,G,2006,2.99,22.99,Behind the Scenes
555,MALLRATS UNITED,A Thrilling Yarn of a Waitress And a Dentist who must Find a Hunter in A Monastery,2006-02-15,133,PG,2006,0.99,25.99,Trailers,Commentaries,Deleted Scenes
556,MALTESE HOPE,A Fast-Paced Documentary of a Crocodile And a Sumo Wrestler who must Conquer a Explorer in California,2006-02-15,127,PG-13,2006,4.99,26.99,Behind the Scenes
557,MANCHURIAN CURTAIN,A Stunning Tale of a Mad Cow And a Boy who must Battle a Boy in Berlin,2006-02-15,177,PG,2006,2.99,27.99,Trailers,Commentaries
558,MANNEQUIN WORST,A Astounding Saga of a Mad Cow And a Pastry Chef who must Discover a Husband in Ancient India,2006-02-15,71,PG-13,2006,2.99,18.99,Trailers,Commentaries,Deleted Scenes
559,MARRIED GO,A Fanciful Story of a Womanizer And a Dog who must Face a Forensic Psychologist in The Sahara Desert,2006-02-15,114,G,2006,2.99,22.99,Behind the Scenes
560,MARS ROMAN,A Boring Drama of a Car And a Dog who must Succumb a Madman in Soviet Georgia,2006-02-15,62,NC-17,2006,0.99,21.99,Commentaries,Deleted Scenes
561,MASK PEACH,A Boring Character Study of a Student And a Robot who must Meet a Woman in California,2006-02-15,123,NC-17,2006,2.99,26.99,Commentaries,Deleted Scenes
562,MASKED BUBBLE,A Fanciful Documentary of a Pioneer And a Boat who must Pursue a Pioneer in An Abandoned Mine Shaft,2006-02-15,151,PG-13,2006,0.99,12.99,Commentaries,Behind the Scenes
563,MASSACRE USUAL,A Fateful Reflection of a Waitress And a Crocodile who must Challenge a Forensic Psychologist in California,2006-02-15,165,R,2006,4.99,16.99,Commentaries
564,MASSAGE IMAGE,A Fateful Drama of a Frisbee And a Crocodile who must Vanquish a Dog in The First Manned Space Station,2006-02-15,161,PG,2006,2.99,11.99,Commentaries,Behind the Scenes
565,MATRIX SNOWMAN,A Action-Packed Saga of a Womanizer And a Woman who must Overcome a Student in California,2006-02-15,56,PG-13,2006,4.99,9.99,Commentaries,Deleted Scenes,Behind the Scenes
566,MAUDE MOD,A Beautiful Documentary of a Forensic Psychologist And a Cat who must Reach a Astronaut in Nigeria,2006-02-15,72,R,2006,0.99,20.99,Trailers,Behind the Scenes
567,MEET CHOCOLATE,A Boring Documentary of a Dentist And a Butler who must Confront a Monkey in A MySQL Convention,2006-02-15,80,G,2006,2.99,26.99,Trailers
568,MEMENTO ZOOLANDER,A Touching Epistle of a Squirrel And a Explorer who must Redeem a Pastry Chef in The Sahara Desert,2006-02-15,77,NC-17,2006,4.99,11.99,Behind the Scenes
569,MENAGERIE RUSHMORE,A Unbelieveable Panorama of a Composer And a Butler who must Overcome a Database Administrator in The First Manned Space Station,2006-02-15,147,G,2006,2.99,18.99,Trailers,Commentaries,Deleted Scenes
570,MERMAID INSECTS,A Lacklusture Drama of a Waitress And a Husband who must Fight a Husband in California,2006-02-15,104,NC-17,2006,4.99,20.99,Trailers,Behind the Scenes
571,METAL ARMAGEDDON,A Thrilling Display of a Lumberjack And a Crocodile who must Meet a Monkey in A Baloon Factory,2006-02-15,161,PG-13,2006,2.99,26.99,Trailers,Commentaries,Deleted Scenes
572,METROPOLIS COMA,A Emotional Saga of a Database Administrator And a Pastry Chef who must Confront a Teacher in A Baloon Factory,2006-02-15,64,PG-13,2006,2.99,9.99,Trailers,Commentaries,Behind the Scenes
573,MICROCOSMOS PARADISE,A Touching Character Study of a Boat And a Student who must Sink a A Shark in Nigeria,2006-02-15,105,PG-13,2006,2.99,22.99,Commentaries
574,MIDNIGHT WESTWARD,A Taut Reflection of a Husband And a A Shark who must Redeem a Pastry Chef in A Monastery,2006-02-15,86,G,2006,0.99,19.99,Trailers,Deleted Scenes
575,MIDSUMMER GROUNDHOG,A Fateful Panorama of a Moose And a Dog who must Chase a Crocodile in Ancient Japan,2006-02-15,48,G,2006,4.99,27.99,Trailers,Deleted Scenes
576,MIGHTY LUCK,A Astounding Epistle of a Mad Scientist And a Pioneer who must Escape a Database Administrator in A MySQL Convention,2006-02-15,122,PG,2006,2.99,13.99,Behind the Scenes
577,MILE MULAN,A Lacklusture Epistle of a Cat And a Husband who must Confront a Boy in A MySQL Convention,2006-02-15,64,PG,2006,0.99,10.99,Deleted Scenes,Behind the Scenes
578,MILLION ACE,A Brilliant Documentary of a Womanizer And a Squirrel who must Find a Technical Writer in The Sahara Desert,2006-02-15,142,PG-13,2006,4.99,16.99,Deleted Scenes
579,MINDS TRUMAN,A Taut Yarn of a Mad Scientist And a Crocodile who must Outgun a Database Administrator in A Monastery,2006-02-15,149,PG-13,2006,4.99,22.99,Deleted Scenes,Behind the Scenes
580,MINE TITANS,A Amazing Yarn of a Robot And a Womanizer who must Discover a Forensic Psychologist in Berlin,2006-02-15,166,PG-13,2006,4.99,12.99,Trailers,Deleted Scenes
581,MINORITY KISS,A Insightful Display of a Lumberjack And a Sumo Wrestler who must Meet a Man in The Outback,2006-02-15,59,G,2006,0.99,16.99,Trailers
582,MIRACLE VIRTUAL,A Touching Epistle of a Butler And a Boy who must Find a Mad Scientist in The Sahara Desert,2006-02-15,162,PG-13,2006,2.99,19.99,Trailers,Deleted Scenes
583,MISSION ZOOLANDER,A Intrepid Story of a Sumo Wrestler And a Teacher who must Meet a A Shark in An Abandoned Fun House,2006-02-15,164,PG-13,2006,4.99,26.99,Behind the Scenes
